Subreddit_Id,Author,CreateTime,Content,Emoji
t5_2riv8,Pokemen,1319522109,I'm so sorry. Many bunny hugs to you from my monsters. She was absolutely adorable and clearly well-loved.  ♥  ,♥
t5_2qh63,dasubergrok,1319523143,Obviously this is a false flag operation the Obama/Soros regime is using to shove a no private match ownership policy down the throats of the Real-American© Germans. ,©
t5_2qh2p,warshbucket,1319523240,Good point. You have earned my official seal of circlejerk © ,©
t5_2r94o,2012Erection,1319523846,"&lt;cough, cough&gt;  In the midst of your rant about the 'under 40's' misuse of language causing you to cringe you seem to have begun your sentence with ""*Us* old folks"" as your subject, causing this under 40 to cringe.  Protip: When choosing a pronoun drop its attendant adjectival phrase and see if you still have subject/verb agreement.        Us all say [✘]      We all say [✔] ",✔
t5_2qore,huhlig,1319523985,"Yep, Its there. Mine Swapped over to this after a little while.        Sign up for the World of Warcraft Annual Pass and get Diablo III® FREE! ",®
t5_2qore,Austaph,1319525176,"I don't care if it doesn't mean anything. I know Blizzard is infamous for how Soon™ it gets things done and all that, but it's exciting.",™
t5_2qpol,ChaosReigns,1319526174,Löl Upvöte Më Too? And thë öther më töö? Öttërs too‼? I dö nöt think that wë shöuldn't upvöte öttërs as wëll. Më töö. Lööks likë a facë -&gt; ö Ö,‼
t5_2qhn3,istara,1319527755,"If it's homeopathic, its ""active"" ingredients won't work any better than a placebo.  That said, there may be something else in it that inadvertently has a calming or soporific effect.  One site (referring to tablets) says:  &gt;Calms Forté™ tablets are composed of four botanicals long used by doctors and health practitioners to soothe and quiet irritated nerves and edginess without sedatives or tranquilizers. In addition, Calms Forté™ includes five biochemic phosphates in 3X potency, which feed and strengthen the nerves of the body, helping you withstand everyday stress and strain.  Those botanicals *may* be effective if they're there in appreciable amounts, ie not the ""diluted to zero"" of homeopathy.  In France there's a teething gel you can get which includes chamomile and valerian, both traditional herbal remedies for insomnia/calming, so those may be safe for infants.",™
t5_2qhb9,rmc,1319530242,Grand so. Just send me your broschures &amp; marketing material so I can see what your back catalog is like. ☺,☺
t5_2rzgi,linktoreality,1319532631,"I'll take the Pisces symbol, please! ♓",♓
t5_2r9vp,brownestrabbit,1319532668,With Heroin and LSD and organic Succanat.™,™
t5_2qpp6,Antalus,1319536103,Yes! ♥,♥
t5_2qqlo,rageagainsthevagene,1319543150,"Wanted to upvote, but generally try to do what's asked of me. 😖",😖
t5_2s8bl,Tailszefox,1319546095,&gt; A wild BRONY appears!  &gt; ▶ HUG &amp;nbsp; &amp;nbsp; &amp;nbsp; &amp;nbsp;  PONY  &gt; &amp;nbsp; &amp;nbsp;ITEM &amp;nbsp; &amp;nbsp; &amp;nbsp; &amp;nbsp; RUN,▶
t5_2qhrv,voyager_dfw,1319546510,"Bullshit.  The main contention we had here is that Nice Guys™ aren't even honest with themselves about their own intentions (again not to be confused with people who are genuinely giving/caring - I know plenty of generous guys who do reasonably well with women.  But at the same time, people don't walk all over them).  Negs and teasing don't work on their own - you need to have the personality and confidence to actually keep the girl around.  If you are a self-hating weak-minded individual, then that's pretty transparent and therefore unattractive.  You would know that if you actually went out and weren't just some keyboard jockey trying to troll a seduction forum.",™
t5_2s8bl,andysonic2,1319546898,&gt; HUG &amp;nbsp; &amp;nbsp; &amp;nbsp; &amp;nbsp;  PONY  &gt;▶ITEM &amp;nbsp; &amp;nbsp; &amp;nbsp; &amp;nbsp; RUN  ---  &gt;▶TWISPKLE DOLL  ---  &gt;You've hurt your chances of ever talking to this person again in your confusion!,▶
t5_2fwo,super__mario,1319546910,"If your place really is that restrictive, then they will monitor you at the router level and record every request you have made to the outside world together with basic stats of the response, like size of downloaded stuff etc.   If your goal is to pretend that you are working and fool your co-workers who might glance at your screen, then why not just use Lynx.   http://lynx.browser.org/  It's a great, fast, secure, text only browser. It's indispensable tool for testing usability of your website, and works great for browsing inconspicuously at work as well :D. Reddit looks good with it. It's also useful for dumping rendered HTML of websites:  `$ lynx -dump www.google.com`        Web [1]Images [2]Videos [3]Maps [4]News [5]Translate [6]Gmail [7]More »        [8]iGoogle | [9]Web History | [10]Settings | [11]Sign in         Google 	      Canada  	 _______________________________________________________        Google Search  I'm Feeling Lucky    [12]Advanced search 	  [13]Language tools        Search: (_) the web (_) pages from Canada         Map your world with [14]Google Map Maker        Google.ca offered in: [15]français         [16]Advertising Programs     [17]Business Solutions     [18]About        Google     [19]Go to Google.com  				© 2011 - [20]Privacy   ",©
t5_2rzgi,TwilightVulpine,1319548817,can i has ♈,♈
t5_2cneq,InVultusSolis,1319551503,"&gt; stop thinking everything is politics  To say that this debate isn't political is foolish. I'll just leave it at that.  &gt; Google: Socialized healthcare affects cancer treatment.  You're just searching for articles and picking ones that favor your point of view, but the only ones you can find are from right wing news sources. Also, your nuanced language almost guarantees that you're going to find articles critical of socialized health care. Try Googling ""Socialized healthcare improves cancer treatment"". Hey look! Wikipedia, a *peer reviewed, verifiable, accredited* source of information comes up as the number two result, not the right-wing, god-centric ramblings of some hick from South Dakota. Let's see what we can learn from this article...  * Per capita gov't spending on health care is *almost double* what it is in the next most expensive nation, Switzerland, and we don't even have a single payer system!  * ""Studies suggest that 40% of U.S. citizens do not have adequate health insurance, if any at all. In Canada, however, as many as 5% of Canadian citizens have not been able to find a regular doctor..."" Sounds like a socialist hellhole to me!  * ""In the United States, access to health care is primarily determined by whether a person has access to funding to pay for treatment and by the availability of services in the area and by willingness of the provider to deliver service at the price set by the insurer. In Canada the wait time is set according the availability of services in the area and by the relative need of the person needing treatment."" Wow! We're learning so much. So it looks to me like the Canadian system *treats all people equally*, regardless of income. Gee, that's a terrible ideal to have. Who cares about the centuries we've been struggling for equality, let's just go back to a feudal aristocracy where only the rich can afford basic health care.  * ""A report published by Health Canada in 2008 included statistics on self-reported wait times for diagnostic services. The median wait time for diagnostic services such as MRI and CAT scans is two weeks with 89.5% waiting less than 3 months. The median wait time to see a special physician is a little over four weeks with 86.4% waiting less than 3 months. The median wait time for surgery is a little over four weeks with 82.2% waiting less than 3 months. In the U.S., patients on Medicaid, the low-income government programs, can wait three months or more to see specialists. Because Medicaid payments are low, some have claimed that some doctors do not want to see Medicaid patients."" So wait, you're telling **me** that the socialist Canadian system *guarantees* that you can see a doctor, even if you're broke, vs. having to struggle to find a specialist that will accept medicaid?   * ""A 2003 survey of hospital administrators conducted in Canada, the U.S., and three other countries found dissatisfaction with both the U.S. and Canadian systems. For example, 21% of Canadian hospital administrators, but less than 1% of American administrators, said that it would take over three weeks to do a biopsy for possible breast cancer on a 50-year-old woman..."" Unlike you, I am not going to cherry pick facts. This statement does support your original claim, that social medicine is slower at stopping cancer. *However*, the vast amounts of people that die for having inadequate health care in the US make this point almost irrelevant, owing to my next **fact**™:  * ""Canadians spend about 55% of what Americans spend on health care and have longer life expectancy, and lower infant mortality rates. **Many** Americans have access to quality health care. **All** Canadians have access to similar care at a considerably lower cost."" There you have it.  &gt; Sorry, you seem to be too liberal...  Liberalism is like money, you can never have too much. I think you misunderstand the meaning of the word ""liberal"" in any case. Liberal = you are free to do as you wish insofar as your rights do not infringe on the rights of others. That's it. Everyone has the right to health care as much as they have the right to free speech or to bear arms.  Edit: Clarity",™
t5_2qlqh,tweet_poster,1319551793,"***Corning***:  &gt;&amp;#91;2011/10/25&amp;#93;&amp;#91;12:01:05&amp;#93;  &gt;[&amp;#91;Translate&amp;#93;](http://translate.google.com/#auto|auto|For all who have asked, just confirmed @Corning Gorilla® Glass is not on the new Galaxy Nexus. For further details please contact Samsung. 'google translate this tweet'): For all who have asked, just confirmed [*@Corning*](https://twitter.com/Corning 'twitter user profile') Gorilla® Glass is not on the new Galaxy Nexus. For further details please contact Samsung.  [&amp;#91;This comment was posted by a bot&amp;#93;&amp;#91;FAQ&amp;#93;](http://www.reddit.com/help/faqs/tweet_poster 'tweet_poster FAQ')[&amp;#91;Did I get it wrong?&amp;#93;](http://www.reddit.com/message/compose/?to=tweet_poster&amp;subject=Error%20Report&amp;message=[Oops!](http://reddit.com/r/Android/comments/loe7j\)%0d%0dPlease leave the subject and this link unaltered, but feel free to add a description here. 'report an error')",®
t5_2qh0u,zimme95,1319552481,Why does it say ® 2005 Microsoft?,®
t5_2qh0s,JimKB,1319554723,"Thanks, Tallon. ❤",❤
t5_2r9vp,apple_scruff,1319554727,"1. just as a photograph, this is AWESOME.   2. i love taking my dog for walk-n-tokes in the woods [too.](http://i.imgur.com/9dNaD.jpg) ♥",♥
t5_2rzgi,sFire,1319557322,A ♑ if you please.,♑
t5_2qm4e,DefiantDragon,1319557358,"Also: Here's their list of ingredients (and what they say about how they work):  **GPC Choline – 100 mg**  Derived from lecithin, Glyceryl Phosphoryl Choline is a phospholipid metabolite found concentrated in neuronal membranes. Unlike less expensive forms of Choline such as Choline Bitrartate, GPC choline is well absorbed and easily crosses the blood brain barrier. Once delivered it supports brain function and learning processes by directly increasing the synthesis and secretion of acetylcholine. Strong acetylcholine has been linked to memory, focus, mental drive, REM sleep states, and the prevention of mental degradation such as in Alzheimers.  **Huperzia Serrata (.5% Huperzine A) – 50 mg**  Commonly known as Northern Firmoss, Huperzia Serrata is one of the most effective natural acetylcholinesterase inhibitors. It contains the well studied alkaloid Huperzine A, which has been tested in a variety of clinical applications and shown to have positive effects on brain function. Acetylcholinesterase (ACE) is responsible for the breakdown of Acetylcholine, and so by inhibiting ACE, more acetylcholine is available to the brain. By using the full spectrum Huperzia Serrata vs. Huperzine A, you also get the benefits of Huperzine B, and other balancing elements of the whole herb.  **Vinpocetine — 5mg**  Derived from the periwinkle plant, vinpocetine helps deliver oxygen to the brain by increasing circulation and blood flow. Extensively studied in Europe, clinical investigations have found it to provide several advantages for the human brain, including memory enhancement, increased cognitive performance, improved cerebral circulation and higher mental acuity and awareness.  **AC-11 – 350mg**  AC-11® the proprietary compound licensed under agreement from Optigenex Inc, is derived from Uncaria Tomentosa, a plant indigenous to the South American rainforest. In a series of peer reviewed scientific and clinical studies conducted by third party laboratories and university medical centers, AC-11® has been shown to help the body’s natural ability to repair DNA. Optigenex Inc is the exclusive patent holder for AC-11®. US patent numbers: 6039949, 6238675 B1, 6361805 B2 Although the exact mechanisms of action are being further investigated, the scientists believe that when the body is subjected to stress affecting the integrity of the DNA, AC-11® helps activate enzymes that are instrumental in the repair processes. This goes beyond other nutritional supplement by protecting the body from damage to its fundamental building blocks: The DNA itself.  **Bacopa (20% Bacosides) — 500 mg**  Bacopa monnieri is an Ayurvedic herb found in the marshlands of India known to enhance clear thinking and support memory function. Ayurvedic masters have touted its cognitive enhancing effects for centuries as Bacopa has been served to Raj’s and peasants alike. Clinical studies show that it has strong antioxidant properties, protects mental function in those with epilepsy who take the drug phenytion, and animal models have shown unequivocally that bacopa improves learning skills.  Bacosides, the active compounds in Bacopa, play a protective role in the synaptic functions of the nerves in the hippocampus, the seat of memory. Inside the hippocampus nerve impulses are transmitted across the synapses and bacopa is believed to help prevent the degeneration that impairs memory and cognition.  **Pterostilbene — 250 mcg**  One of the hottest extracts in the field of nootropics, pterostilbene is quickly surpassing its cousin resveratrol in popularity. A natural antioxidant abundant in blueberries, anecdotal evidence suggests that this particular antioxidant is effective in eliminating free radicals that contribute to ‘mental fog’. Combined with the other antioxidants in the formula, this adds further well rounded protection and health benefits to AlphaBrain.  **Mucuna Pruriens (50% l-Dopa) — 200mg**  Mucuna pruriens, commonly known as velvet bean or cowhage is another Aryuvedic herb with a long history of traditional use for treatment of the brain. As science later discovered, mucuna is one of the few plants to contain high quantities of l-Dopa, a precursor to the neurotransmitter dopamine. L-dopa crosses the blood brain barrier and converts into dopamine, an important brain chemical involved in mood, sexuality, and movement. Mucuna pruriens also has antioxidant properties and is currently being studied in conjunction with the prevention/treatment of Parkinson’s disease.  **GABA — 300mg**  GABA or gamma-aminobutyric acid, discovered in 1950, is the most important and widespread inhibitory neurotransmitter in the brain. Symptoms of unbalanced excitation in the brain includes restlessness, irritability, insomnia, and even seizures. By inhibiting excessive excitability GABA is able to induce relaxation, analgesia, and even aid in sleep. In the Alpha Brain formula, GABA plays an important role in balancing out the brain, and ensuring that the mind stays calm even as the ‘engines’ are roaring.  **Oat Straw (10:1) — 300 mg**  Oat straw is one of natures most powerful anxiolytics (anti-anxiety treatments) and has been prescribed for of a wide range of nervous conditions. It has also been shown to help with exhaustion related neurological pains and is commonly given as a natural alternative to help combat ADHD or ADD. Our formulation is extremely powerful, in a 10:1 concentration, and like Gaba, serves to make AlphaBrain the completely unique product that it is… A balanced nootropic.  **Vitamin B6 – 15 mg**  Pyridoxine (Vitamin B6) is one of the body’s busiest vitamins, involved in an estimated 101 chemical reactions. One of its primary tasks is to aid in the manufacturing of amino acids and neurotransmitters. Some of these neurotransmitters are serotonin, norepinephrine, dopamine and GABA. Without Vitamin B6 many of the processes happening with the active ingredients in the formula would not be nearly as effective.",®
t5_2qlqh,BabySinister,1319557426,"have we forgotten about marketing and brand name strength? and again, strengthened glass is going to be stronger then regular glass, whether it says Gorilla© or something else.  i don't think any phonecompany out there would want to use regular glass on their products. ",©
t5_2s4lk,Noveacc,1319557622,"*Mmmmm*   That is *really* fuckin' sexy, that pantyhose and those heels are *just* killer. ♥   ⁪    You should dress up more often, well no sense beating around the bush, you look great regardless of what you're wearing, so you should just post more often no matter what!    :D",♥
t5_2qh33,dmcnelly,1319557898,&gt;Visit cornsugar.com  ©2011 Corn Refiners Association  Nice try though.,©
t5_2qhlw,westsan,1319558064,"I think black barbers and hair stylists are the best in the world. Why?  * **The fade is awesome** I always laugh at thinning white guys thinking 'If you only went to a black barber he could have faded that out smooth for you.' * **Ladies hair** is so avante guard!! From straight looks to braids to nappy and natural. I love some of the looks for all the styles (and yes, extensions too!!). In Japan there is a huge genre of what they call ""Black Hair"". It's one of the largest hair groups in a popular SNS. * **Braids** I love a woman in french braids!! Luv it♥ * The **natural look**, if done right is totally adorable.   OK. Let's hear yours.",♥
t5_2qh33,thereal_me,1319558436,The *Big* Licker™,™
t5_2qq5c,Noveacc,1319558662,"Into the sea of comments I go!  That being said, I *fucking* love it when you two post.  It's just so *sensual* and loving, I can't help but smile at how beautiful you two look together.  ♥",♥
t5_2qh13,tommym,1319559482,"darknet credits would be cool, if the world Dan Suarez's Daemon and Freedom™ were a reality.....",™
t5_2qh1u,yul_brynner,1319559750,Then you realize that eBay and PayPal are a big bunch of grifters and fucks™,™
t5_2qh3p,Cablefist,1319560512,This is so fucking sweet. ♥  Don't forget to explicitly tell him that you appreciate him.,♥
t5_2qh16,nascentt,1319561900,&gt;That's not how copyright works.[©2011 nascentt] ,©
t5_2rzgi,BobisOnlyBob,1319561976,"♊  Because I was born June 12th (yes 6/12), I'm a game programmer...",♊
t5_2s9kj,Leissa_Schriever,1319563129,"**Plasba!!! You're back!!! ♥**  &lt;*goes to hug him, gets trapped inside his body*&gt;",♥
t5_2qh0u,Peter_Nincompoop,1319564182,"Yes, I understand that these trademarks are commonly used to describe adhesive bandages and facial tissues, that doesn't make it any less of a threat to their trademarks, which is why they constantly try to enforce the idea that Band-Aids and Kleenex are specific terms for their products by displaying the ™ whenever they use those terms. If they did not make the effort to do so, their trademark is lost to common terminology, and then any competitor can use that term for their own products.",™
t5_2sypj,tweet_poster,1319564876,"***Corning***:  &gt;&amp;#91;2011/10/25&amp;#93;&amp;#91;12:01:05&amp;#93;  &gt;[&amp;#91;Translate&amp;#93;](http://translate.google.com/#auto|auto|For all who have asked, just confirmed @Corning Gorilla® Glass is not on the new Galaxy Nexus. For further details please contact Samsung. 'google translate this tweet'): For all who have asked, just confirmed [*@Corning*](https://twitter.com/Corning 'twitter user profile') Gorilla® Glass is not on the new Galaxy Nexus. For further details please contact Samsung.  [&amp;#91;This comment was posted by a bot&amp;#93;&amp;#91;FAQ&amp;#93;](http://www.reddit.com/help/faqs/tweet_poster 'tweet_poster FAQ')[&amp;#91;Did I get it wrong?&amp;#93;](http://www.reddit.com/message/compose/?to=tweet_poster&amp;subject=Error%20Report&amp;message=[Oops!](http://reddit.com/r/GalaxyNexus/comments/lomps\)%0d%0dPlease leave the subject and this link unaltered, but feel free to add a description here. 'report an error')",®
t5_2qh1i,GargamelCuntSnarf,1319564978,♥ you.,♥
t5_2rp9s,Boondoc,1319565150,thanks. i looked around before but couldn't find it. then after i asked i looked around some more and found the full breakdown.   for anyone else who might want to see  AMOUNT OF DOUBLE XP TIME PER PRODUCT  MTN DEW® 20 OZ. BOTTLE = 15 MINUTES  MTN DEW® 12-PACK = 45 MINUTES  MTN DEW® 20-PACK FROM WALMART = 90 MINUTES  32 OZ. OR 44 OZ. MTN DEW® FOUNTAIN CUPS = 15 MINUTES  2.125 OZ. OR 2.875 OZ. DORITOS® BAGS = 15 MINUTES  11.5 OZ. DORITOS® BAG = 45 MINUTES  FAMILY SIZE 17 OZ. DORITOS® BAG FROM WALMART = 90 MINUTES  POWER BONUS (ANY MTN DEW® AND DORITOS® COMBINATION) = 15 MINUTES,®
t5_2qqjc,Jakravdian,1319565803,"""All that hype for an MP3 player? Break-thru digital device? The Reality Distiortion Field™ is starting to warp Steve's mind if he thinks for one second that this thing is gonna take off.""  Pure Gold.",™
t5_2qh0u,vjmurphy,1319566562,"&gt; You were minifigs, not Lego® bricks.   FTFY",®
t5_2qh1u,metropolitain,1319568916,"R. O. Shipman. *Corgi Edition* reissued in 1975. © 1955, 1961",©
t5_2qh33,Bouffont,1319569980,[I too have a Willy Warmer™](http://i.imgur.com/m2X4H.jpg) ,™
t5_2qpp6,PolishxThunder,1319570207,"Season 3 got placed into gold, Season 4 got placed into diamond.  ♥ Progress",♥
t5_2rlua,jcready,1319572558,"**Day:** noun /dā/   *days, plural*  1. A period of **twenty-four hours** as a unit of time, reckoned from one midnight to the next, corresponding to a rotation of the earth on its axis  &gt;  Shipped By: UPS ***Next Day*** Air Saver®   &gt;  Order Processed: 10/24/2011 7:23 A.M.",®
t5_vf2,lightningrod14,1319572744,"(well, on the huge off chance the manana™ goes viral... you cant be too careful.)",™
t5_2qiqo,fwr,1319573974,Nie wspominając że na Wykop nie ma sekretnego Karma Store™,™
t5_2r9vp,actionaaron,1319574415,Soon.....™,™
t5_2qh16,sputnikv,1319574613,"""*The only question remaining is if, when the iPod phone fails, it will take the iPod with it. ®*""  whut",®
t5_2qpp6,Level_75_Zapdos,1319574874,I envy you. PvZ is my favorite matchup ♥,♥
t5_2qh1e,RightLibertarian,1319576528,NEVER QUESTION THE HOLOCAUST™! ,™
t5_2qh1e,RightLibertarian,1319576678,OMG HOW DARE YOU CALL OUT THE JEWS FOR ANYTHING  OY ITS ANOTHER HOLOCAUST™!  OY ABE GET THE HUMAN SKIN LAMP SHADES OUT OF STORAGE WEVE GOT TO DISTRACT THE GOYIM FROM OUR GENOCIDE OF ARABS!  OY VEY MORE SHECKELS FOR THE HOOKNOSED!,™
t5_2qh1e,RightLibertarian,1319576763,"*ahem*  Are you all fucking retarded? Gas chambers at Dachau?  ANY REFERENCE FOR THAT PLEASE?  Of course not, even the hook-nosed parasites don't say that the mass ""Gassings"" occurred at Dachau.   Fucking lord people, read a book about the Holocaust™ written by someone who isn't a -stein or a -berg.",™
t5_2rfxx,Skerh,1319576824,OOO MAMA ! ©Dunkey,©
t5_2qq5c,Noveacc,1319577032,"*Oh my*, these three pictures *plus* all the others are incredibly sexy.   I just ♥ those thighs.  ;)  ",♥
t5_2qqlo,SparklyyCherry,1319577692,You're very welcome ♥,♥
t5_2qh33,AggressiveAggressive,1319577853,Beeftacularly™ hungry! FTFY,™
t5_2sekm,Ranzera,1319577959,The Awkward Teen Pity Force™,™
t5_2qh13,PurplDwarf,1319578550,I think that the very idea that a cat can type is at once disturbing and fascinating.  Don’t get me started on bees.  xo♥∞.  ,♥
t5_2qk68,mrpbody33,1319578920,I have four holes left and I would love to see some Redditors sponsor them.  Here is what you get for the different levels of sponsorship.    *Hole Sponsorship - $20*     ♦ Tee sign placed at a hole of your choice     ♦ Mention in the player's program   *Silver Sponsorship - $35*     ♦ Mystery Gift!     ♦ Tee sign placed at a hole of your choice     ♦ Mention in the player's program     ♦ Preferred starting group pairing if playing  *Gold Sponsorship - $50*     ♦ Your banner at player central     ♦ Full page ad in the player's program     ♦ Your business card or other item distributed to each player     ♦ Mystery Gift!     ♦ Tee sign placed at a hole of your choice ,♦
t5_2qh68,andrewmp,1319579527,TL;DR - Corporations are great  © 2001-2011 Rogers Communications. All rights reserved. ,©
t5_2qh33,Philloz,1319580869,He should know the alt code for ™  Dwight I am disappoint,™
t5_2qgzt,Tbrooks,1319580939,it seems like a better deal compared to [this thermostat](http://www.amazon.com/Honeywell-YTHX9321R5061-Prestige®-Comfort-System/dp/B005Y29KL4/ref=sr_1_cc_1?s=hi&amp;ie=UTF8&amp;qid=1319580804&amp;sr=1-1-catcorr) or [this thermostat](http://www.amazon.com/Honeywell-VisionPro-Prog-Universal-Thermostat/dp/B003IQVKVG/ref=sr_1_1?s=hi&amp;ie=UTF8&amp;qid=1319581002&amp;sr=1-1) if the nest one has a better feature set.,®
t5_2qh0u,ParkerM,1319583241,What are you talking about? Go-Gurt® is yogurt you can eat on the go!,®
