Subreddit_Id,Author,CreateTime,Content,Emoji
t5_2cneq,sickpharaoh,1318111224,"Ohhhhh, noooo, it's Mitt Romney's *religion*, how could we disrespect his *religion*?  The real answer here is that religion is not relevant to politics in *any* case. Matters of policy should not be decided based on faith.  If you're a human being, odds are you have religious faith of some kind. So if you're calling Mormonism a cult, state your reasoning for doing so. It can't be the size of the group, as there are about as many Mormons in the world as there are Jews, and no one would call Judaism a cult. It can't be because the beliefs are ""ridiculous,"" being that they are no more testable or disprovable than any religious or supernatural claim made by any other religion. The bottom line is that religion does *not* belong in conversations about public matters.  Maybe if politics weren't so muddled with religious bullshit people would actually think about policy and vote based on that, instead of thinking ""are they are of my Faith™?""",™
t5_2qh2p,Mayniak0,1318111959,"""Many Americans Uneasy with Mix of Religion and Politics: Section I - Religion and Public Life."" Pew Research Center for the People &amp; the Press. Web. 31 Dec. 2010. &lt;http://people-press.org/report/?pageid=1081&gt;. This article contains statistics and surveys on religious influence in government. It also contains some statistics on people’s opinions on how important religion is in government and if it is a good or bad thing.  Judis, John B. ""The Chosen Nation: the Influence of Religion on US Foreign Policy."" Carnegie Endowment for Internaitonal Peace. Web. &lt;http://www.carnegieendowment.org/files/PB37.judis.FINAL.pdf&gt;. This source discusses the influence of religion in America, specifically in US foreign policy. It focuses mostly on the policies of George W. Bush.  Blankley, By Tony. ""Voters Give Mixed Marks to Influence of Religion on Government Policy - Rasmussen Reports™."" Rasmussen Reports™: The Most Comprehensive Public Opinion Data Anywhere. Web. 31 Dec. 2010. &lt;http://www.rasmussenreports.com/public_content/politics/general_politics/december_2010/voters_give_mixed_marks_to_influence_of_religion_on_government_policy&gt;. This source gives statistics on the opinions of voters on how much they believe religion is an influence in the United States Government. It also describes people’s opinions on how much it should be an influence in politics.  ""Regarding Religion's Role in Government."" Angelfire: Welcome to Angelfire. Web. 31 Dec. 2010. &lt;http://www.angelfire.com/wi/theosis/religionrole.html&gt;. This Source describes some of the reasons why religion should not be directly involved in politics. The main reason mentioned is the vast diversity and number of religions and their disagreements.   Show, Tavis Smiley. ""Religion's Influence on American Politics : NPR."" NPR : National Public Radio : News &amp; Analysis, World, US, Music &amp; Arts : NPR. Web. 31 Dec. 2010. &lt;http://www.npr.org/templates/story/story.php?storyId=3047102&gt;. This is an NPR discussion on religious influence on politics in America between Rev. Barry Lynn of Americans United for the Separation of Church and State and Joe Laconte, a fellow in religion and a free society at the Heritage Foundation.  Dynamicdrive.com, By. ""How Does Religion Affect America's Economy and Politics - Free Article Courtesy of ArticleCity.com."" ArticleCity.com - Free Articles for Reprint. Free Articles for Your Web Site and Newsletters. Submit Your Articles to Our Articles Directory. Web. 31 Dec. 2010. &lt;http://www.articlecity.com/articles/religion/article_433.shtml&gt;. This is a short article on religion and how it affects both politics and economics in America.  ""Vatican Engineered Victory for Pelosicare | US Opinion and Editorial Right Side News."" The Right Conservative News Sites | Right Side News. Web. 31 Dec. 2010. &lt;http://www.rightsidenews.com/200911097231/editorial/us-opinion-and-editorial/vatican-engineered-victory-for-pelosicare.html&gt;. This is an article about the direct influence of the Pope and the Vatican in American politics and specifically in healthcare.  Hindu Leads Senate in Prayer to 'the Transcendental'"" A Free Press for a Free People. Web. 31 Dec. 2010. &lt;http://www.wnd.com/news/article.asp?ARTICLE_ID=57357&gt;. This article describes an event in the California Senate in which a Hindu man led the senate in prayer. Many in attendance were outraged by a man of a non-Christian religion making a prayer in Senate.  ""Senate Prayer Led by Hindu Elicits Protest - Washingtonpost.com."" Washington Post - Politics, National, World &amp; D.C. Area News and Headlines - Washingtonpost.com. Web. 31 Dec. 2010. &lt;http://www.washingtonpost.com/wp-dyn/content/article/2007/07/12/AR2007071202007.html&gt;. This article by the Washington Post describes an event in which three people had to be led out of the Senate room before the opening prayer as a Hindu had been invited to lead the prayer.  Comparison, By. ""Growing Number of Americans Say Obama Is a Muslim: SECTION 2. RELIGION AND POLITICS."" Pew Research Center for the People &amp; the Press. Web. 31 Dec. 2010. &lt;http://people-press.org/report/?pageid=1780&gt;. This source describes multiple statistics on religious involvement in politics as well as the involvement of specific churches. It also discusses the belief of many Americans that Obama is a Muslim and how that affects their opinions of him and his administration.  Washington, Nasaw In. ""US Elections: Barack Obama Announces Grants for Faith-based Services | World News | Guardian.co.uk."" Latest News, Comment and Reviews from the Guardian | Guardian.co.uk. Web. 31 Dec. 2010. &lt;http://www.guardian.co.uk/world/2008/jul/01/barackobama.uselections2008&gt;. This is an article about Barrack Obama’s proposal of grants to religious-based groups (churches, etc.) that provide social service such as food banks.  Saturday, Edition. ""Politics and Religion in U.S. Government : NPR."" NPR : National Public Radio : News &amp; Analysis, World, US, Music &amp; Arts : NPR. Web. 31 Dec. 2010. &lt;http://www.npr.org/templates/story/story.php?storyId=5068741&gt;. This is an NPR discussion about Religion and Politics in which Jim Wallis, author of God’s Politics: Why the Right Gets it Wrong and the Left Doesn’t Get it, explains his opinions on the subject.  Longley, By Robert. ""Bush-friendly Church Gets $1 Million 'Faith-based' Grant."" U.S. Government Info - Resources. Web. 31 Dec. 2010. &lt;http://usgovinfo.about.com/od/rightsandfreedoms/a/bushchurch.htm&gt;. This is an article discussing a church in Philadelphia whose pastor endorsed George W. Bush politically and during Bush’s Presidency received large amounts of government funding. ",™
t5_2rch1,thehalfwit,1318112631,"Get a tattoo on your forehead that reads, ""I ❤ CP"".",❤
t5_2qh0u,sqwzmahmeatybts,1318113075,♥Best Fawns Forever♥,♥
t5_2qh1i,suckit2me,1318113111,High Tech Company™,™
t5_2qpp6,Lifp,1318113461,"Here's a reply, just for you ♥",♥
t5_2qpp6,TKRomeo,1318113494,"Don't worry, I understand your sarcasm. ♥",♥
t5_2qio8,ohnoitshansolo,1318114195,"^ ^ ^ ^  Also, its ™'d...",™
t5_2qj9g,TheSoothie,1318120836,I'd get rid of everything except the Shutterstock®,®
t5_2r2jt,BZenMojo,1318124166,"&gt; To clarify, Nice Guys™ seek sexually fulfilling relationships and thus are giving away emotional intimacy unconditionally.  If we assume that romance is merely a combination of emotional and sexual attraction.  Except, this implies that there are no such things as asexual romantic relationships.  Janeane Garofalo has been in one for over a decade.  Tim Gunn is asexual but homoromantic.  Romance must be something asexual if asexuals can experience those feelings.  It must be something other than mere intimacy if we categorize it outside of familial and platonic female relationships.  It must be something other than camaraderie if we categorize it outside of platonic male relationships.  I and a great many philosophers may not quite understand what it is, but at the very least I can argue that a Nice Guy^TM can seek it without wanting to fuck his friend.  And a Bad Girl^TM can seek it without wanting a hug.  EDIT: To clarify myself, a woman may want wine, a slow kiss on a gondola, and a man to whisper he loves her but not necessarily want him to tear her panties off and go down on her while she's drunk on wine in the front of the gondola.  A man may want a woman curled up in his lap stroking his face telling him she needs him but he may not necessarily want a blowjob.  Sexual adults may expect it at this point, and they may hope for it, being sexual, but this does not mean their experiences define the boundaries of romantic relationships.",™
t5_2qh1i,nchammer326,1318127327,"Not if I added some exclamation points to it and put in italics and bold!  ***Duke of the Metal Jewellery!!!***© by nchammer326!!!  BAM! Originality, baby!",©
t5_2qh0u,magickamushrooms,1318127948,Thank you ♥,♥
t5_2qqlo,HybridEmblem,1318128878,I always have a blast at costume parties. Except last year I was at one which was mid october making it pretty boring. So I headed out to a bar instead [dressed like this and got free drinks from strangers all night ♥](http://a4.sphotos.ak.fbcdn.net/hphotos-ak-snc4/73422_10150289316335599_585040598_15604121_4316013_n.jpg)  upvotes all night if you can pull off Granger :),♥
t5_2qzb6,randomselfdestruct,1318129243,thank you for being an awesome person much ♥♥♥,♥
t5_2qgzt,Dweller,1318131054,"Great, you have lots of options:  HDMI™ Inputs: 2 PC Inputs: 1 Video Component (YPbPr): 2 S-Video Inputs: 1 Video Composite Input: 1 L/R Audio Input: 1 RF Coaxial Input: 1  Also, for reference:  Vertical Resolution (Digital Compatibility): 720p  All the current TiVos, or any current DVR for that matter, would work fine with your TV. You will want to use the HDMI input. ",™
t5_2qh0u,TheContrarian2,1318132007,"...if you're a rib joint with sloppy sauce®!  Otherwise, give us a nice cloth towel. ",®
t5_2rfxx,HaudNomen,1318139678,"Honestly? It's 'cause Amumu has one of the best solo-queue initiations. Not one of the best initiations in general, mind you. Just one of the best in solo-queue.  Amumu's initiation is a big, flashing sign that tells your team, ""Hey, you dumb-ass, carried on my broad, masculine back, fuckers! We're goin' in now!"" It forces your team to actually pay attention to what's happening and do what needs to be done to win a team-fight.  No other initiation really has that same quality. Not Ashe, not Alistar, not Malphite, not even Galio. So... yeah. Amumu is ""*Initiation for Dummies™: Elo Hell Edition*"".",™
t5_6,mags87,1318140434,[we know some science](http://cache2.artprintimages.com/p/LRG/8/860/XTFJ000Z/art-print/nasa-astronaut-rover-flag-on-moon-©spaceshots.jpg),©
t5_2qh4w,iWUVdawgs2,1318141048,Wanna know how to pay for something? ?Q:?|_|?U::?|_|?N:P ~*Sir  Swazey****ಠ_ರೃ*  FUCK YOU MY RELIGION IS IN MY ♥:ART::LOGIC:♥ NOW  ~ANONYMOUS       **♥** ,♥
t5_2qh4w,iWUVdawgs2,1318141751,&gt;Well done good sir  ~** *Hyper♥Cube M00T* **  &gt;I liek chocolate milk&lt; *~BATMAN MY NIGGA BATMAN SAID IT IN THE ONE FUCKING HILARIOUS COMIC YOU DUMB CUNT PUNTS*  &gt;How do I green code on here? ~Sir Reality ♥  &gt;THERE ARE FUCKING BOTS IN THE SYSTEM LULZ ~♥NewFag Anonymoose  &gt;Ok so I hear reddit is a company now. Let's give them ALL the money. Go to your preferences of your account and make your votes public. Then only vote when you give a shit. Hmm I wonder what would happen if I clicked the use for research purposes. I should sue. I am 12 and what do all these buttons do at the same time? Maybe I can sell my account someday soon. . . ~ *Don Reality ♥*,♥
t5_2qh4w,iWUVdawgs2,1318143070,"&gt;This is now the meaning of a neutral post       ~♥*Anonymous*♥~ ChEcK_OuThEfUnKEY MONKEY ^&amp;^  &gt; Go learn some reddit green code my niggaz  ~Anonymous  ""FUCK YO COUCH NIGGA"" ~Chaote *♥*  &gt;The fucking united nations don't realize the affect of the Texas Law. If you willingly come to the union you get 5 states. That is political power out the ass if you become one with us and play OUR lawyer game. How clear does it have to be? Therefore 1/5% of the vote of the school children vote should count as a single ""I DO""  ~Don *Reality* &gt;This is now the meaning of a neutral post       ~♥*Anonymous*♥~ ChEcK_OuThEfUnKEY MONKEY ^&amp;^  &gt; Go learn some reddit green code my niggaz  ~Anonymous  ""FUCK YO COUCH NIGGA"" ~Chaote *♥*  ~Anonymous   ""Now what. . .it is stuck with the words submitting. . .so I guess there is a way around it by re-clicking. . .hmmm oh well. . ."" As said by ilovedogsto of kongregate",♥
t5_2qh1i,HighwireAct,1318143215,"I feel like there should be a soft drink called ""My Own Piss"", endorsed by Bear Grylls.  ""Getting late.  Better drink My Own Piss™.""",™
t5_2qh4w,iWUVdawgs2,1318143488,"""Don't report the fucking bugs you dumb shits"" ~Shiny Meta-Knight of Dragon Quest.  &gt;Everything you type go into find the word for ""i""  P+♥NP equals.  I claim the ""♥"" in this subreddit only.  I AM CALLING FIRST FOR POSSESION BY PICTURE next to my name. Google can't read /r/chaos directly through &gt;so this is the Psuedo Sophite if I am an alchemist. Go find out what I mean by alchemist. Hint: The psychologist is only 1/2. So yea. if you google back here chaos will reign on your head some day LULZ. Then who was Phone you might add. Well I am telling you there is another way for txt'ING just by witnessing the power of the ""♥""",♥
t5_2qh2v,carignanboy,1318145043,⌂ Montreal ✈ Shenzhen Merci!,✈
t5_2qqlo,thesplendor,1318146281,If you were in the Derp Mart Restroom™ then how did you hear a car door open?,™
t5_2qmeb,eributt,1318147171,I can never pick one so here's me and a couple of my [babies](http://i52.tinypic.com/abk092.jpg) ♥ ,♥
t5_2qh2p,bfmGrack,1318153140,"As a South African, I'd like to say fuck you and your country (♥)",♥
t5_2rch1,Mizzenmast,1318159791,"Ah, baby's don't have strong enough muscles to hold onto the trapeze and swing. So, for your spawn, I suggest putting them in a small howizter (you should be able to get one fairly cheaply at your local military surplus store). Depending on the age of your kid it may need putting in a sabot for a while - just until it has gained enough mass to form a tight seal just with its body.   Obviously this will require practice. Your two options are either have your wife stay home and shit out a constant stream of babies until such a time as you can perfectly time swinging across with the trapeze and catching the baby (also getting the trajectory right so the baby dies not end up in the punji pit or two towns over). The other option is to practice with watermelons and other baby shaped fruits.  I call this adapted cannon my 'Kindekanone^®'.   Again here is a picture of the now adapted trapeze/Kindekanone^® set up. [KUNST](http://i.imgur.com/gpsaG.png) ",®
t5_2qh2p,Matti_Matti_Matti,1318160761,"I was born an atheist.  My first solid memory of god is compulsory Religious (ie Christian) Instruction classes at age 10 and thinking of the instructor, ""What a dick."" I think that during one class we were all ignoring an instructor and making a racket so a teacher came in and told us off. Also, the ""stories for kids"" were crap. Much preferred ""The Jungle Book"".  Investigated various religions as part of my Search For Greater Understanding™ (Scientology, Christianity, Hare Krishna, New Age) and they were all silly. Currently having fun with a bit of Buddhism for its philosophical questions but I still have difficulty conceiving of anyone who can have all the answers, be they deity or buddha. I especially have never encountered anything or anyone who is worth worshipping; they would have to be better than me and I'm still looking for that.  Also still looking for a religion that says, ""We are not the chosen people. Those people over there are. We must worship them for their closeness to god.""",™
t5_2qh1n,Elliptical_Tangent,1318165778,"It depends ont he GM crop.  Monsanto's got a GM soybean that's resistent to Roundup™ which is a fossil-fuel-derived herbicide.  Generally speaking GM crops are designed to be subsidized with hydrocarbon fertilizers/pesticides/herbicides because they've had all the survival traits removed fromt heir gene pool.  They're only there to yield, not survive; so chemical survival enhancers are needed.  &gt;In any case, the dominance of oil in our society is still a function of political-economic mis-balance and corruption.  Now, maybe, yes.  But you have to look and see that most of our life exists because of fossil fuels.  Look at population graphs and you'll see the slope of population increase was very low until we started the age of Steam, when it started to climb steeper.  Once oil comes into play, it's damn near vertical.  If our society is irrationally prejudiced in favor of hydrocarbons (and I agree, it is) it's because it's been so central in our development.",™
t5_2r4w1,3825,1318171879,"&gt;You can even manage your Cloud Servers on-the-go via your iPhone®, iPad® and iPod® touch.   any reason for staying within the iOS ecosystem? ",®
t5_2qh0s,MattTC111,1318172702,Why does this remind me so much of the Cornballer®,®
t5_2r83n,ofblankverse,1318174749,"Yup. If she could go one place in the *entire world*... she chooses a giant, overpriced shopping mall. The contents of that backpack pretty much sum up all she knows about being human- media, junk food, and ""I Heart ____©""",©
t5_2qh0u,ProudNativeTexan,1318176289,"Meanwhile, outside Post-it® Notes HQ.... http://imgur.com/RvKtw",®
t5_2qh1i,231995,1318176319,Winchester® Xpert® 22 Long Rifle Rimfire Ammo ,®
t5_2qh1i,margalicious,1318176867,GINGER BEARD ♥,♥
t5_2qh1e,kosmotron,1318178374,"Actually, that's not an adjective — it's a compound noun, like ""United States"" in ""United States Supreme Court"" or ""desk"" in ""desk lamp"".  Now, if the article makes that kind of a fundamental error in syntactic analysis, that shouldn't give you a lot of confidence.  As a matter of fact, the word ""lego"" has undergone the same type of grammatical assimilation that happens to many types of name brands.  We say ""bandaids"", ""hoovers"", ""Walmarts"", ""zippers"", ""aspirins"", and so on, even though they are brand names just like ""LEGO"".  LEGO insists on only speaking of their product as ""LEGO bricks"" because they don't want the word to become generic, just like if you read material from the Band-Aid company, they call their products ""Band-Aid® brand adhesive strips"".  But these are legalese terms used for legal reasons — you'd sound like a corporate shill at best (and a fool at worst) if you insisted that people should say ""Band-Aid® brand adhesive strips"".  But for some reason, some LEGO people get so fixated on this branding.  I am always amazed by the small group of hardcore LEGO enthusiasts that actually get caught up trying to advance the LEGO company's futile goal of reshaping the language.  I don't blame these companies for trying, but come on — real language is much more organic and interesting than that.  Very few words maintain a constant meaning, pronunciation, or lexical category; this is one of the things that is so cool about language.",®
t5_2rzgi,1cnygirl1,1318178462,Could I have aquarius? Please? ♒,♒
t5_2cneq,mvlazysusan,1318179161,"Last election there was a lot of electoral college  delegate shenanigans, after 4 years of ""fixing"" that manipulation by the powers that be, were all set. ☺    Ron has more military donations than ALL other republican candidates combined.   If tonight he (Ron)  ordered  the Pentagon to occupy DC, By sunrise tomorrow it would be occupied.   May you live in interesting times. ",☺
t5_2qpp6,punci,1318179177,"i lold pretty hard too! but in reality, this 'tribute' is straight up mean. i love incontrol, i don't understand why all the hate..i wish he will do better in the future! ♥ ",♥
t5_2qmh1,Xylemicarious,1318179569,"My personal favorites are Mater Suspiria Vision, White Ring, ✝ DE△D VIRGIN ✝, Balam Acab... And then maybe Cosmetics, who are somewhere between witch house and italo disco. I tend to like most of it though...  Edit: Unghf, how did I forget oOoOO? Someone slap me.",✝
t5_2qh0u,itwascrazybrah,1318179777,It's a sacrifice I'm willing to make. FOR PEACE.™,™
t5_6,godofallcows,1318180633,Microsoft^® **Thingy**,®
t5_2qh1e,Strutham,1318180634,"I don't get it. Is slightly linguistically alternative usage of the trademark (still only applied to actual Lego, it's not like Mega Bloks are being sold as *Lego*) somehow detrimental to the interests of the Lego company? Should I expect a lawsuit when I say I'm typing this on an *Apple* instead of an Apple *computer* or a *MacBook*? Is someone losing out on profits if I have a Guinness instead of *a pint of Guinness® stout*?  If the Lego company are concerning themselves with my usage of grammar in everyday speech, they can kindly go step on a brick (a *Lego*, even).",®
t5_2qqdb,mvlazysusan,1318181183,"No!   If it is a ""crime"" than they should DEMAND a trial by jury. if it is not a ""crime"" then they should file individual civil suet for unlawful arrest and official misconduct.   Have an up-vote for having the right idea anyway.  ☺",☺
t5_6,timewarp,1318181533,Available on Microsoft^® **Mongo**,®
t5_6,Minifig81,1318181662,Better than the Apple® iThingy! ,®
t5_2qqjc,Tibyon,1318181840,"An awesome alternate reality for a show or movie would be one where John Wilkes Booth was deemed a hero, restarting the civil war, eventually leading to the South becoming he dominant political party, with every president after him being a direct descendant. ©",©
t5_2rfxx,reckl3ss,1318182843,If you can't speak ☘☘☘☘ you are new to LoL.,☘
t5_2qhef,helveticannabis,1318183792,"I absolutely agree with this advice.   I also grew up in the church – well, half the time. My parents divorced when I was very young, after which my dad found a born-again Christian church and devoted himself to it full-time. I spent every other weekend with him: Saturdays were usually spent cleaning the fellowship hall or otherwise preparing for the next day, and all Sunday was spent in the church. At one point, when he ran into some financial trouble, we even lived in the church.   This is the chronology of my coming out story: good friends (sophomore year of high school), atheist mom and stepdad (junior year of high school), born-again Christian dad (a few months after coming out to my mom and stepdad). I was lucky in that I didn't live with my dad primarily and he was not exclusively financially supporting me. But even so, coming out to friends and select family members first really helped because I was able to almost do ""test runs"": learn potential reactions, practice answering questions that usually come up (""How long have you known?""), gain confidence, etc. By the time I came out to my dad, I had experience on my side. I think if I came out to him first, I'd be much more vulnerable and insecure, and it wouldn't have been a good experience.   **tl;dr: I agree with the above, and would suggest (if you haven't already) coming out to close friends and maybe some family members that may be more accepting.**  In any case, best of luck. Please update us on any progress you make. I admire your courage and hope everything works out in the end. ❤",❤
t5_2qh1i,NotYetDomestic,1318183987,"Allrecipes.com is fabulous! Try this:  Ingredients •	1/2 of a 16 ounce package linguine •	1 cup fresh or frozen broccoli flowerets •	2 tablespoons butter •	1 pound skinless, boneless chicken breast, cut into 1 1/2-inch pieces •	1 can (10 3/4 ounces) Campbell's® Condensed Cream of Mushroom Soup (Regular, 98% Fat Free, 25% Less Sodium or Healthy Request®) •	1/2 cup milk •	1/2 cup grated Parmesan cheese •	1/4 teaspoon ground black pepper Preparation •	Prepare the linguine according to the package directions in a 3-quart saucepan. Add the broccoli during the last 4 minutes of the cooking time. Drain the linguine and broccoli well in a colander.  Heat the butter in a 10-inch skillet over medium-high heat. Add the chicken and cook until it's well browned, stirring often.  Stir the soup, milk, cheese, black pepper and linguine mixture into the skillet. Heat, stirring occasionally, until the mixture is hot and bubbling. Serve with additional Parmesan cheese.  Grilled Chicken &amp; Broccoli Alfredo: Substitute grilled chicken breasts for the skinless, boneless chicken.  Shrimp &amp; Broccoli Alfredo: Substitute 1 pound fresh extra large shrimp, shelled and deveined for the chicken. Cook as directed in Step 2 until the shrimp are cooked through.  Spanish-Inspired Tip: Reduce the chicken to 1/2 pound and omit the Parmesan cheese. Prepare as directed above. Stir 1/2 pound peeled cooked shrimp, 1/4 pound chorizo or ham, diced and 1 teaspoon paprika into the skillet in Step 3.  Indian-Inspired Tip: Omit the Parmesan cheese. Substitute 1 cup uncooked basmati rice for the linguine. Prepare as directed above. Stir 1 teaspoon curry powder and 1/2 teaspoon ground cumin into the skillet in Step 3. Sprinkle with toasted slivered almonds, if desired.  Asian-Inspired Tip: Omit the Parmesan cheese. Substitute 1 package (6 ounces) rice noodles for the linguine. Prepare as directed above. Stir 1 tablespoon soy sauce, 2 cloves garlic, minced and 2 teaspoons minced fresh ginger root in to the skillet with the chicken in Step 2. ",®
t5_2rzgi,blind_bamboo,1318184614,♍  Thank you!,♍
t5_2rzgi,rakin_bacon,1318187429,Would perform me this one MoThErFuCkInG mIrAcLe? ♑ ,♑
t5_2qh13,Jivicus,1318189306,Democracy®  -FTFY,®
