Subreddit_Id,Author,CreateTime,Content,Emoji
t5_2qh9z,ActualPaperText,1318800325,"References 	.	1.↵ Controlled Substances Act, 21 USC §801. 2007.(http://www.deadiversion.usdoj.gov.libproxy.lib.unc.edu/21cfr/21usc/801.htm). (Accessed August 2, 2011). 	.		.	2. Yarett I. How high are you? Newsweek 2010;155(7):56. 	.	3.↵ Santa Monica, CA: ProCon.org; 15 Legal medical marijuana states and DC: laws, fees, and possession limits. (http://medicalmarijuana.procon.org/view.resource.php?resourceID=000881). (Accessed December 16, 2010). 	.		.	4.↵ Ndetei DM, Arboleda-Flórez J, Gawad T. Forum: decriminalization versus criminalization of cannabis. Curr Opin Psychiatry 2008;21(2):127-128.CrossRefMedline 	.		.	5. Cohen PJ. Medical marijuana: the conflict between scientific evidence and political ideology. Part one of two. J Pain Palliat Care Pharmacother 2009;23(1):4-25.CrossRefMedline 	.		.	6. Reinarman C, Cohen PD, Kaal HL. The limited relevance of drug policy: cannabis in Amsterdam and in San Francisco. Am J Public Health 2004;94(5):836-842.Abstract/FREE Full Text 	.	7. Medical marijuana on trial. Lancet Oncol 2001;2(5):251.CrossRefMedline 	.		.	8.↵ Martin BR. Medical marijuana—moving beyond the smoke. Lancet2002;360(9326):4-5.CrossRefMedline 	.		.	9.↵ Christenson V. Courts protect Ninth Circuit doctors who recommend medical marijuana use. J Law Med Ethics 2004;32(1):174-177.CrossRefMedline 	.		.	10.↵ Hoffmann DE, Weber E. Medical marijuana and the law. N Engl J Med2010;362(16):1453-1457.CrossRefMedline 	.	11. Controlled Substances Act, 21 USC §812. 2007.(http://www.deadiversion.usdoj.gov.libproxy.lib.unc.edu/21cfr/21usc/812.htm). (Accessed August 2, 2011). 	.	12. Gathering the evidence on medical marijuana. Nature 2001;410(6829):613.CrossRefMedline 	.		.	13.↵ Cohen PJ. Medical marijuana 2010: it’s time to fix the regulatory vacuum. J Law Med Ethics 2010;38(3):654-666.CrossRefMedline 	.		.	14.↵ Chang AE, Shiling DJ, Stillman RC, et al. Delta-9-tetrahydrocannabinol as an antiemetic in cancer patients receiving high-dose methotrexate. A prospective, randomized evaluation. Ann Intern Med 1979;91(6):819-824.Abstract/FREE Full Text 	.		.	15. Rog DJ, Nurmikko TJ, Friede T, et al. Randomized, controlled trial of cannabis-based medicine in central pain in multiple sclerosis. Neurology 2005;65(6):812-819.Abstract/FREE Full Text 	.		.	16. Rog DJ, Nurmikko TJ, Sarantis NS, et al. A long-term open-label trial of safety and efficacy of Sativex®, a cannabis based medicine, in central neuropathic pain due to multiple sclerosis. J Neurol 2006;253(suppl 2):S100. 	.		.	17.↵ Zajicek J, Fox P, Sanders H, et al. Cannabinoids for treatment of spasticity and other symptoms related to multiple sclerosis (CAMS study): multicentre randomised placebo-controlled trial. UK MS Research Group. Lancet 2003;362(9395):1517-1526.CrossRefMedlineWeb of Science 	.		.	18. Zajicek JP, Sanders HP, Wright DE, et al. Cannabinoids in multiple sclerosis (CAMS) study: safety and efficacy data for 12 months follow up. J Neurol Neurosurg Psychiatry2005;76(12):1664-1669.Abstract/FREE Full Text 	.		.	19. Duran M, Pérez E, Abanades S, et al. Preliminary efficacy and safety of an oromucosal standardized cannabis extract in chemotherapy-induced nausea and vomiting. Br J Clin Pharmacol 2010;70(5):656-663.CrossRefMedline 	.		.	20. Ware MA, Wang T, Shapiro S, et al. Smoked cannabis for chronic neuropathic pain: a randomized controlled trial. CMAJ 2010;182(14):E694-E701.Abstract/FREE Full Text 	.		.	21. Martín-Sánchez E, Furukawa TA, Taylor J, et al. Systematic review and meta-analysis of cannabis treatment for chronic pain. Pain Med 2009;10(8):1353-1368.CrossRefMedline 	.		.	22. Abrams DI, Jay CA, Shade SB, et al. Cannabis in painful HIV-associated sensory neuropathy: a randomized placebo-controlled trial. Neurology 2007;68(7):515-521.Abstract/FREE Full Text 	.		.	23. Chang AE, Shiling DJ, Stillman RC, et al. A prospective evaluation of delta-9-tetrahydrocannabinol as an antiemetic in patients receiving adriamycin and cytoxan chemotherapy. Cancer 1981;47(7):1746-1751.CrossRefMedline 	.		.	24. Ellis RJ, Toperoff W, Vaida F, et al. Smoked medicinal cannabis for neuropathic pain in HIV: a randomized, crossover clinical trial. Neuropsychopharmacology2009;34(3):672-680.CrossRefMedline 	.		.	25. Greenberg HS, Werness SA, Pugh JE, et al. Short-term effects of smoking marijuana on balance in patients with multiple sclerosis and normal volunteers. Clin Pharmacol Ther 1994;55(3):324-328.MedlineWeb of Science 	.		.	26. Wilsey B, Marcotte T, Tsodikov A, et al. A randomized, placebo-controlled, crossover trial of cannabis cigarettes in neuropathic pain. J Pain 2008;9(6):506-521.CrossRefMedlineWeb of Science 	.		.	27. Merritt JC, Crawford WJ, Alexander PC, et al. Effect of marihuana on intraocular and blood pressure in glaucoma. Ophthalmology 1980;87(3):222-228.MedlineWeb of Science 	.		.	28.↵ Turcotte D, Le Dorze JA, Esfahani F, et al. Examining the roles of cannabinoids in pain and other therapeutic indications: a review. Expert Opin Pharmacother2010;11(1):17-31.CrossRefMedline 	.		.	29.↵ Barnes MP. Sativex: clinical efficacy and tolerability in the treatment of symptoms of multiple sclerosis and neuropathic pain. Expert Opin Pharmacother2006;7(5):607-615.CrossRefMedlineWeb of Science 	.		.	30.↵ Hall W, Degenhardt L. Adverse health effects of non-medical cannabis use.Lancet 2009;374(9698):1383-1391.CrossRefMedlineWeb of Science 	.		.	31.↵ Moskowitz H. Marihuana and driving. Accid Anal Prev 1985;17(4):323-345.CrossRefMedlineWeb of Science 	.		.	32.↵ Solowij N, Stephens RS, Roffman RA, et al. Cognitive functioning of long-term heavy cannabis users seeking treatment. Marijuana Treatment Project Research Group.JAMA 2002;287(9):1123-1131.Abstract/FREE Full Text 	.		.	33. Tashkin DP, Coulson AH, Clark VA, et al. Respiratory symptoms and lung function in habitual heavy smokers of marijuana alone, smokers of marijuana and tobacco, smokers of tobacco alone, and nonsmokers. Am Rev Respir Dis 1987;135(1):209-216.MedlineWeb of Science 	.		.	34. Aldington S, Williams M, Nowitz M, et al. Effects of cannabis on pulmonary structure, function and symptoms. Thorax 2007;62(12):1058-1063.Abstract/FREE Full Text 	.		.	35. Cabral GA, Dove Pettit DA. Drugs and immunity: cannabinoids and their role in decreased resistance to infectious disease. J Neuroimmunol 1998;83(1-2):116-123.CrossRefMedlineWeb of Science 	.		.	36. Bolla KI, Brown K, Eldreth D, et al. Dose-related neurocognitive effects of marijuana use. Neurology 2002;59(9):1337-1343.Abstract/FREE Full Text 	.		.	37. Degenhardt L, Hall WD. The adverse effects of cannabinoids: implications for use of medical marijuana. CMAJ 2008;178(13):1685-1686.FREE Full Text 	.		.	38.↵ Wang T, Collet JP, Shapiro S, et al. Adverse effects of medical cannabinoids: a systematic review. CMAJ 2008;178(13):1669-1678.Abstract/FREE Full Text 	.		.	39.↵ Grotenhermen F, Leson G, Berghaus G, et al. Developing limits for driving under cannabis. Addiction 2007;102(12):1910-1917.CrossRefMedline 	.		.	40.↵ MacDonald S, Anglin-Bodrug K, Mann RE, et al. Injury risk associated with cannabis and cocaine use. Drug Alcohol Depend 2003;72(2):99-115.CrossRefMedlineWeb of Science 	.		.	41.↵ Sewell RA, Poling J, Sofuoglu M. The effect of cannabis compared with alcohol on driving. Am J Addict 2009;18(3):185-193.CrossRefMedlineWeb of Science 	.		.	42.↵ Kelly E, Darke S, Ross J. A review of drug use and driving: epidemiology, impairment, risk factors and risk perceptions. Drug Alcohol Rev. 2004;23(3):319-344.CrossRefMedlineWeb of Science 	.		.	43.↵ Bates MN, Blakely TA. Role of cannabis in motor vehicle crashes. Epidemiol Rev.1999;21(2):222-232.FREE Full Text 	.		.	44.↵ Walsh JM, de Gier JJ, Christopherson AS, et al. Drugs and driving. Traffic Inj Prev2004;5(3):241-253.CrossRefMedline 	.		.	45.↵ Ramaekers JG, Berghaus G, van Laar M, et al. Dose related risk of motor vehicle crashes after cannabis use. Drug Alcohol Depend 2004;73(2):109-119.CrossRefMedlineWeb of Science 	.		.	46.↵ Drummer OH, Gerostamoulos J, Batziris H, et al. The involvement of drugs in drivers of motor vehicles killed in Australian road traffic crashes. Accid Anal Prev2004;36(2):239-248.CrossRefMedlineWeb of Science 	.		.	47.↵ MacDonald S, Mann R, Chipman M, et al. Driving behavior under the influence of cannabis or cocaine. Traffic Inj Prev 2008;9(3):190-194.CrossRefMedline 	.	48.↵ Substance Abuse and Mental Health Services Administration. Rockville, MD:Department of Health and Human Services; 2010. Results from the 2009 National Survey on Drug Use and Health: volume I. Summary of National Findings. NSDUH series H-38A, HHS publication SMA 10–4856 findings. (http://oas.samhsa.gov.libproxy.lib.unc.edu/NSDUH/2k9NSDUH/2k9Results.htm#1.1). (Accessed November 1, 2010). 	.		.	49.↵ Jones RK, Shinar D, Walsh JM. State of Knowledge of Drug-Impaired Driving.Washington, DC: National Highway Traffic Safety Administration; 2003.  ",®
t5_2qh1i,stupid_dresses,1318801835,"On the same side it also seems to have ""5·1·1♀Y"" but I can't make out much more, it perhaps says Raphael after this",♀
t5_2cneq,crackduck,1318802021,"It's the ""wang-banger 'power user' DNC corp. sponsored circle-jerk©"".",©
t5_2qpp6,NationalKids,1318802631,Reddit should sponsor him. MKP ♥,♥
t5_2qpp6,deknozz,1318806817,Yes. Yes he did. HuK ♥,♥
t5_2sa5n,U731lvr,1318809035,"Fucking cancer institutes always wanting more money, I sometimes wonder if it isn't just some sca...oh wow, 13oz Starbucks® Bottled Mocha Frappuccino® Coffee Drink is only $3?!  I'll take 2! I've earned it.",®
t5_2r9vp,asianpersuation,1318813487,chalk boards ♥,♥
t5_2qpp6,gay_for_HuK,1318814459,"You'd be surprised how few situations arise where this account is relevant.  But I cherish those occasions nonetheless, and maybe one day comment of mine will be so popular that HuK can see me confess my ♥ ",♥
t5_6,Gabriaugangst,1318816830,Dont forget the hearts ♥♥♥,♥
t5_2r9vp,GoodChaptheIII,1318817512,"I know. ♥ My frient, her parents are well off. So, her back yard has this huge chalk board that'd be covered all the time. Fun times, yes, those were fun.",♥
t5_2s54g,Sperata,1318819648,P.S. ♥ Dirty Projectors,♥
t5_6,berry0080021,1318820316,Mosquito Magnet ® is the market leader in the home and garden for biting insect trap and is the only perpetual solution to mosquito problems,®
t5_2qhze,gbeier,1318820588,"2 main differences:  * Prevents ""portafilter sneeze."" Have you ever pulled the PF out of the group too quickly after a shot is done (or worse yet, when you've ground too finely and choked the machine)? Sometimes you can get a spray of hot water and grounds as a result. The 3-way relieves that pressure and discharges that water to the drip tray.  * Makes cleaning the group easier because you can backflush detergent into the group without getting detergent into the boiler. (Detergent in the boiler would be A Bad Thing™.) The practical impact of this is that you might disassemble the group for cleaning a little less frequently.  Both of these are really only matters of convenience/ease of ownership. Neither impacts the taste of the shots. ",™
t5_2qh1i,classicfm,1318821152,"Fairness - be fair! Freedom - give them every opportunity to grow! - waterline - make it clear that they cannot make decisions below the watermark, that could sink the ship! All this, courtesy of a man, I loved and worked for... Wilbur Gore, inventor of Gore-tex™ and founder of WL GORE &amp; Associates",™
t5_2s7yr,68Cadillac,1318821348,"&gt;This coming from someone who absolutely hated everything about thier life at one time, and hated herself, most of all.  Ding. Me too.  &gt;Maybe some day you can go to an actual real meeting, and see how that goes...but maybe not.   Your choice.  Mine is mine.  I like mine.  See here's the thing with that statement. You don't, and other AA people don't, think they're being biased with that. I have meetings. I have a support group. Just not InvisibleSkyWizardMan™ brand. But the AA-crew continually undercut and downplay my sobriety by writing and saying that stuff all the time. ""Actual real meeting"" What is that? I read that as my support isn't real. My sobriety, illusion. I know you're trying to be nice. But at every turn I'm getting ""Why don't you go to a meeting?"", ""You need to go to a meeting"", ""Just try a meeting"", ""You'll lapse if you don't go to a meeting"". Fuck AA.  I'm the one in control of my sobriety, not some imagery friend. I'm responsible. I sobered myself up. I keep myself sober. AA's steps strip that from me, and want me to play the powerless victim. NO. I'm the one with the power. I'm the captain of the ship called ""Me"".  You can do it to. You don't need the crutch of AA. You have to power to captain your own life. You've already done it. AA just wants to you credit some god for your efforts. You don't need them to stay sober.",™
t5_2qka0,srob101,1318823271,The game is goofy.  It would add to the game.   ✔ ,✔
t5_2qh8e,zj5u3n3,1318827542,It is a feature of some cars. e.g. Mercedes has a Speedtronic™ variable speed limiter.,™
t5_2cneq,sheasie,1318828122,Reminds me of Facebook™.,™
t5_2qh1i,VividLotus,1318828432,"I don't think it accomplishes anything. I absolutely see the point of civil disobedience when it comes to an unjust law, and think that disobeying these particular laws can indeed lead to change-- such as when people have disobeyed laws that involved racism or sexism (e.g. people violating laws about racially segregated bathrooms during the Civil Rights Movement in the U.S.). However, I cannot fathom how intentionally violating laws about stuff like sleeping in parks, obstructing sidewalks, etc. accomplishes anything. You are in no way Sticking It To The Man™ by getting arrested pointlessly.",™
t5_2qh1i,GamerLioness,1318828618,"This is a treasure trove of amazing stories. ...Well, I guess it's time to share my Really Fucking Weird Thing™.  I interact with video game characters in my head a lot. Some common scenarios involve characters from The Legend of Zelda, Mario, and Team Fortress 2, as well as various others. Yes, I have lots of ""real"" friends, but IT'S SO MUCH MORE FUN INSIDE MY HEAD.  Fun times, indeed.",™
t5_2qpp6,LostAltKey,1318829168,MKP♥♥♥,♥
t5_2qh0u,ksx___,1318832048,☑ googled 'checkmark box symbol' to help make a point on reddit,☑
t5_2qh0u,wherestheanykey,1318832582,"&gt; properly cooked steak   Is cooked to a minimum of 45♥C (120♥F) [forgive the hearts... I forgot the ascii code for degrees].  Beyond that, it's mostly just texture for most people.",♥
t5_2qh78,opus-thirteen,1318833187,"I might be coming from an Old Guy™ perspective, but do you plan on including and hands-on pieces?  Showing process from sketches and drawings to final was kind of mandatory for me.  Might want to check out the schools you are most interested in and see if they have some 'suggested practices' guidelines.",™
t5_2qpp6,Huckorris,1318834038,"I enjoyed [K]9 alot.  Not to say that dat archon isn't pretty awesome as well.  I love a Sc2 commentator that can make me laugh, no matter how cheesy it was.  All four fit the bill. :D ♥",♥
t5_2qh0u,KingCarnivore,1318835220,Tax fraud is the American Way™,™
t5_2qh7f,coldfu,1318838427,&gt;2/3 cup LIBBY'S® 100% Pure Pumpkin  This is not a recipe! &amp;#3232;\_&amp;#3232; ,®
t5_2qh0u,pieninja,1318840366,"Generally speaking Asian cultures cut up their food before eating, unlike our proto-European ancestors, who barbarically preferred (and still prefer) to cut their meat on their own plate.   You don't need a fork or spoon if food is pre-cut into small sizes (this is a bit chicken-egg: small size due to chopsticks, or chopsticks due to small size?).   Until quite recently Europeans ate with either two knives (if you had the money) or with your hands. I think for a long time it was considered excessively effeminate to eat with any utensils. Real Men™ ate with their hands!       It's also dependent on cultural development. Generally speaking, with cultural 'civilization' comes a distancing from food: you don't touch it with your hands, you prepare it in a separate area or pot instead of at the table/cave floor, etc.   China and other Asian cultures were a bit ahead of the curve on that one, so they developed a simple tool to aid in the eating of pre-prepared food. Whereas Europeans went through the whole hand-meat phase and then had to adapt tools to aid in the devouring of entire pieces of meat.",™
t5_2qh2p,Audiovore,1318841466,"Christmas use to have a religious claim, we've just disassociated it as a culture. Much like how Kleenex™, Band-Aid™, [and many others](http://en.wikipedia.org/wiki/List_of_generic_and_genericized_trademarks) have become common words. We could easily do the same for Anno Domini.",™
t5_2qh5j,redditsuxass,1318841871,"The right turned their ""only 53% of Americans pay income tax"" talking point into a parody of OWS. There's a site where people photograph themselves with letters that say they don't blame the rich for their shitty lot in life, and that anyone who does is just a whiner who should Suck It Up™ and Get a Job™ or 3. ",™
t5_2qh0u,torgeist,1318844491,ͼʘ̢̮.ﮨ̮ͽ☑ ☑ ☑ ☑ ☑ ☑ ☑ ☑ ☑ LAWL☐ ☐ ☐ ☑ ☑ ͼʘ̢̮.ﮨ,☑
t5_6,AOptix,1318848140,AOptix Technologies have given its best in devlopment of avand-grade Iris Recognition Technology and Iris Recognition Software. AOptix Technologies leading edge innovations in adaptive optics are creating breakthrough products for Iris Recognition Technology and Iris Recognition Software. The AOptix InSight® has redefined what can be expected from biometric systems.,®
t5_2se5q,helgirl,1318850149,"[Here's my FA at gradient](http://imgur.com/ekmUt.jpg) (Taken with my new phone! Much better quality cam than my old phone's)  I wish I'd done a little research into how to do gradients before I started though. It never occurred to me to use anything like a sponge, so these are just painted on.  The polishes I used are:  The base blue: ""Blue Flouro"" by T.B.N. (Totally Beautiful Nails) Medium Blue/Green: ""8|9 Green with Envy"" by Rimmel (60 Seconds) Topped with a green glitter by ""Blue Place"" which I got from eBay for the tips and I also used ""500 Disco Ball"" from Rimmel (I ♥ Lasting Finish) and ""Glitter"" from T.B.N. to try and blend it in a bit better ",♥
t5_2sv8o,invisiblekid,1318850635,"Intel® Celeron® 900; 2GB DDR3-800 RAM; 250GB 5,400RPM Hard Drive; Intel® Graphics Media Accelerator 4500M; Microsoft Windows 7 Home Premium (64-bit)   its not really meant for gaming but its all i got",®
t5_2qh0u,Providing_the_Source,1318851792,"FYI, if you're using a Mac™ you can get ™ by pressing **shift-alt-2** at the same time™.",™
t5_2qh1e,Chachamaru,1318851989,Douche n' co™ ,™
t5_2qh0u,SteiniDJ,1318852156,"And if you're not using a Mac™, you can hit Alt+0153 (on your NumPad™).  Soon™ you'll be adding ™ to everything you can think of.",™
t5_2qh61,dcss,1318852748,"""YouTube™ Ratings Preview"" for Chrome does just that.",™
t5_2qh0u,imeddy,1318853704,"Stop, Hammer™",™
t5_2qh0u,potat0,1318854308,OKAY™,™
t5_2qh0u,donjuantriumphs,1318854655,"Steve Jobs may have died, but Steve Jobs™ will live FOREVER.",™
t5_2qh0u,pudumtish,1318854792,"TIL Google Chrome actually recognizes ™ as ""tm"", and therefore you can go to a site like ™obile.com",™
t5_2qu49,NoAirBanding,1318856222,KickPuncher™ ?,™
t5_2qh1i,mrahh,1318857010,Holy hell. Insta-wood™,™
t5_2s3qj,realrasengan,1318857929,"Companies like Google allow the use of their Android™ Trademark based on specific criteria/regulation.  Additionally, other companies such as Denso Wave International allow the use of QR Code™ and so forth.  As such, a company who registers Bitcoin can follow suit.  Cheers, rasengan",™
t5_2qh0u,whatthefuckisareddit,1318859801,You big dummy™,™
t5_2rybl,eric_twinge,1318860098,&gt;Vi-Shape® is now Kosher!  OMG where's my wallet?!?!,®
t5_2qh19,RumpleForeSkin72,1318861375,"&gt;and does nothing in the background.  including real-time protection, I do use it on my ""thumb drive of power®"" though as a portable app.",®
t5_2qh0u,nolez,1318861444,You're doing it wrong™,™
t5_2qh0u,nolez,1318861495,"I don't know what that is, but I don't think it's English™.",™
t5_2rz8w,StilRH,1318861704,"Thanks guys and thanks to those who private messaged me. I've started to switch up my home and working environments - bottles of water everywhere‼ I find them nice to look at but I don't tend to draw much *thinspiration* from pictures of my current weight or posters of my ideal weight, but little messages on post-its everywhere seem to do the trick.  I have no idea how to break the eating triggers but I plan to make myself more conscious of the thought process. I feel bad &gt; eat I hope to replace with I feel bad &gt; 20 press ups &gt; still want to eat? As I've read that others find exercise removes cravings, and also it's an extra step between the impulse and the action, so yeah, fingers crossed.  On nutrition, I love the look at some of the eating plans but I feel very overwhelmed with all the different plans one can take. I want to start losing weight my own way - less calories in, exert more effort - for now while I get used to calorie restriction and the headaches, fatigue and cravings that go with it, and also getting into the routine of training again.  I live with my partner and she can indulge all she likes and still has a near six pack (freak metabolism :)) and she is a horribly fussy eater. So while on a budget and a diet I have to plan meals to accommodate both of us (I could cook separate dishes, but that might push food costs up if things are not in bulk).  But after 10lbs my own way I'll definitely switch things up and go with an established eating plan. And I'll definitely give the Cambridge diet a good look over :) Thanks‼",‼
t5_2qh1e,dcgi,1318861914,Filmed in Hipstervision™,™
t5_2qh0u,grumpyoldgit,1318864057,You shit not ™  Though this is a laptop so it was a bollox.,™
t5_2qh0u,nibalizer,1318865051,In 10.7 Lion Option-2 produces the ™.,™
t5_6,halfway240,1318865833,[As good as the real thing™](http://i.imgur.com/ppQjs.jpg),™
t5_2qh0u,perado,1318866613,Happy Birthday dude! Fuck Bitches Make Money!! ♥  You will find someone else one day ,♥
t5_2qpp6,tweet_poster,1318867263,***@IM_NesTea_***  *Twitter Profile:*  &gt;***임재덕***  &gt;*No url set in profile.* &gt; &gt;User since: *2010/07/06* &gt; &gt;Location: *Korea* &gt; &gt;*NesTea ♥ aLicE* &gt; &gt;Friends: **8** Followers: **156** Listed: **3** Tweets: **3**  *Last tweet/conversation (at time of this comment):*  ***IM_NesTea_***:  &gt;[2011/10/17][15:25:28]  &gt;[[Translate]](http://translate.google.com/#auto|auto|트위터를 자주 못들어오네요 귀찮아서 ㅋㅋㅋㅋ 'google translate this tweet'): 트위터를 자주 못들어오네요 귀찮아서 ㅋㅋㅋㅋ  [[This comment was posted by a bot][FAQ]](http://www.reddit.com/help/faqs/tweet_poster 'tweet_poster FAQ')[[Did I get it wrong?]](http://www.reddit.com/message/compose/?to=tweet_poster&amp;subject=Error%20Report&amp;message=[Oops!](http://reddit.com/r/starcraft/comments/lf7zm\) 'report an error'),♥
t5_2qh1i,event_horizon_,1318868315,never surrender™,™
t5_2qh0u,funkymonkey1002,1318870938,Just alt+2  ™,™
t5_2qhad,kcrobinson,1318871593,"Three more issues:  1) Encoding issue where Café appears as CafÃ©. I've seen this before. It's just because the feed is providing the data as iso-8859-1 and you're interpreting it as UTF-8.  2) I want the ability to filter by deal provider. If I want to remove results from Tippr or ScoutMob, or show only results from Groupon, I should be able to.  3) For the love of God, please make it easier to get past the pop-up. There is no way in hell that I am ever signing on with my Facebook account, and your argument of ""the value we can provide to you is a million times more if we know who you are"" is complete and utter bullshit. All you're doing is making your site more difficult to work with.",©
t5_2qh0u,skyshock21,1318872022,shift-alt-2 gives me €.  alt-2 gives me ™,™
t5_2qh0u,cbear3000,1318872534,☻↓☺§? I give up,☺
t5_2qh0u,funkymonkey1002,1318873375,¡™£¢∞§¶•ªº–≠  alt + the number row of a US mac keyboard.,™
t5_2qh1i,brock_lee,1318874381,Dick Wipes™!,™
t5_2sazo,sharpsharp69,1318874800,"PlayStation®3専用ソフト「ダークソウル」にて、発生している不具合を修正改善するため、新たなアップデートファイルver1.04の配信を予定しております。具体的な改善項目および配信日程については、確定次第こちらのページにて改めてご案内させていただきます。  また、現段階で改善を予定している主な不具合および現象は以下の通りです  Google Translates to:  Software-only PlayStation ® 3 ""Dark Soul"" in order to better fix the bugs that are occurring, we plan to deliver a new ver1.04 updates. Items and delivery dates for specific improvements, the guide will be here again soon confirmed by page.  In addition, the symptoms are the major bugs and improvements planned at this stage are:  So, no xbox update? I knew buying it on the xbox was a bad idea, I just assumed that with xbox live I would be able to play with friends easier. Fuck",®
t5_2qh1i,willis77,1318875002,"&gt; All photos taken with wheelchair bound grandma were horrific - testicles everywhere.  Brought you by, *The Internet*™",™
t5_2qh1i,fixorater,1318879048,"""Don't fuck up""™",™
