Subreddit_Id,Author,CreateTime,Content,Emoji
t5_2qh0u,justanothercommenter,1317429517,More Borderline Child Porn™ for Anderson Cooper to salivate over.,™
t5_2qh0u,justanothercommenter,1317429620,More Borderline Child Porn™ for Anderson Cooper to salivate over.,™
t5_2qh0u,gotnate,1317429754,"™ is available on the iPad in the emoji ""keyboard""  *the more you know* =^=^==☆",™
t5_2qh3b,gotnate,1317432502,"½ï𝍥ȋ𝍥ïね_åø😃ï  I could go on, but unicode is fucking huge, and it already took me 20 minutes to pick out candidate characters for some of those.",😃
t5_2qt1c,dethbunnynet,1317432828,"Fuck yeah cheese.  &lt;3 the Mars Cheese Castle as a place that's nearby with good variety.   Correction:  💗 the Mars Cheese Castle.  If Mac users can go a few years without getting the *look of disapproval* then Windows users can go a while without our glorious, full-color emoji.",💗
t5_2qq5c,Noveacc,1317433462,"Absolutely *gorgeous*, I don't know what else to say.  You're just *so* pretty.   ♥",♥
t5_2qq5c,Noveacc,1317434403,"It'd be my pleasure to feel such a gorgeous voluptuous backside against my body.    ⁪  Seriously, I'm sitting here with a raging stiff just *thinking* about your big sexy ass.    ♥  ",♥
t5_2qh3s,ThePlumBum,1317435203,"Natural fiber-based polymers are sooooo last season. Zecor® Umbrellas are what's hip now. I'm not expecting Earth to keep up with the current galactic fashion trends, but come on! Get with the solar system, man. Retro isn't going to be in for another three galactic cycles. You don't go out into the rest of the Milky Way dressed like that do you?  ",®
t5_2rlua,bobbycash,1317435284,"Well, assuming that M98B is a bolt action, and according to Google© it is, then it should apply.",©
t5_2qh1a,castillar,1317436701,"Right: instead, the public key (as I understand it) of the signing keypair is embedded in the UEFI, probably in a TPM chip. At boot, the bootloader waves its signature at the UEFI process, which can then verify that the loader was signed by a trusted key and that the signature matches the bootloader.  For the commercial Linux vendors, this will be a hassle, but workable: they can work with UEFI implementers to embed their signing keys alongside Microsoft's, so that the Red Hat or Oracle or SuSE key is already installed. From there, they can either extend LiLO to include the necessary signature-waving module or simply contribute an open-source signature-waving module and then supply packages for their distributions with bootloaders that are signed by their official keys (remember: the signature-waving module has to be open-sourced to meet GPL, but the *signature* doesn't).  The problem, I think, is going to be the less centralized Linux distributions in which someone will now have to be designated The Holder Of The Keys™ and will have to be responsible for signing bootloaders whenever they're updated. The ability to disable UEFI is a (somewhat) good start, since it allows people to simply default to the same level of security they have now (which on Linux, isn't bad--not too many bootloader attacks for Linux machines at the moment). But for anyone who wants to dual-boot or who wants the ability to verify the bootloader, the ability to add public keys to the UEFI trusted keychain is going to be an absolute requirement. The trick is going to be convincing UEFI vendors that it's a necessary feature when Microsoft won't require it at all.",™
t5_2qioo,walruscronkite,1317436809,"Gateway nv53 AMD Athlon™ II X2 dual-core processor M300 (2.00 GHz, 1 MB L2 cache, 2DDR2 667 MHz, 35 W) 4gb ram Windows 7  It turns on and i can get to a setup by pressing f2. Then i just get a black screen with errors saying Pxe-E61 Media test failure, check cable Pxe-m0f exiting broadcom pxe rom operating system not found 0200 error ",™
t5_2qh0u,cheeseburgerpizza,1317439012,"Those basic lightning bolts do it for you?  Here, go crazy then: ⚡⚡⚡⚡⚡⚡⚡⚡⚡⚡⚡⚡⚡⚡⚡⚡⚡⚡⚡⚡",⚡
t5_2qh0u,sydiot,1317441826,brought to you by Philadelphia Cream Cheese^®,®
t5_2qq5c,Noveacc,1317442645,Now if only I could snuggle up and get my hands on those gorgeous thighs...    ♥,♥
t5_2s4lk,Noveacc,1317443445,♥  I'd be there in a heartbeat if I could.  :),♥
t5_2qh1i,n0rs,1317447108,"I use SyncToy for laptop↔fileserver↔pc synchronisation and backup. Free, no arbitrary limit. Seems alright, haven't shopped around for anything since it works for me.",↔
t5_2rfxx,Osmodius,1317448953,Soon (™),™
t5_2qn4t,vonpigtails,1317450778,"To follow up what saiariddle said, also take a look on the sidebar of [r/LA](http://www.reddit.com/r/LosAngeles) under ""related subreddits"" and you'll find a lot of smaller subreddits you can join by clicking the ""I ♥ LA"" button.  There are a crap-load of reddit LA meetups on the [meetup.com site](http://www.meetup.com/LA-Redditors/)... and you are always welcome to start/suggest one!!",♥
t5_2sgcr,keepster33,1317451384,"Learn the damn language instead of relying on electronic tools. It only took me 684 universal time units to learn it and only cost like #♥`◙ groomblecks, hell that's less than the cost of buying the translator. ",♥
t5_2qq5c,Noveacc,1317453393,"**HOT**  That is sexier than I would've *ever* expected, seriously, I'm smiling like crazy at how cute that is.     ♥   ",♥
t5_6,I_would_hit_that_,1317453985,"It could be that some retail stores such as WayTooBigSuperLargeChineseGoodsOutlet® start selling upcoming holiday paraphernalia MONTHS before the holiday arrives in an effort to boost sales.  This raises awareness of the holiday early on, an as a result the excitement of the holiday is dulled by the constant onslaught of reminders that it is approaching.",®
t5_2qh1i,ivegotabooner,1317457485,╔══════════════ღ☃ღ══════════════╗ ~ ~ ~ ~ ~ ~ ~ ~~ Repost this if ~ ~ ~ ~ ~ ~ ~ ~ ~ ~ you are a beautiful strong black woman ~ ~ ~ ~ ~ ~ ~~ ~ who don’t need no man ~ ~ ~ ~ ~ ╚══════════════ღ☃ღ══════════════╝,☃
t5_2qh0u,BlackChocobo,1317457725,"Am I the only one who can see this?   ©Erik Johansson   www.alltelleringet.com    Look at the bottom of the picture, the artist's name and site is right there. It would have been nice if he'd linked to the source, but he didn't claim it was his and it's not like he cropped out the watermark or anything.",©
t5_2qh1i,gruntmeister,1317463424,"'Murrca is the ""best country in the world""™ and built on slavery - so?",™
t5_2qh0u,shadowsteppa,1317464962,"I ♥ calculus, sucks about the answer being the right one though and not getting credit",♥
t5_2qh03,thewetcoast,1317467355,The Aperture Hobson's Choice™.,™
t5_2rgkm,jape42,1317468676,"Can some help me parse this non sentence from their faq/announcement?:   ""5. Is Intel® OpenCL SDK fully conformant with the OpenCL 1.1 Specification? Yes. Intel® OpenCL SDK 1.5 is fully conformant with the OpenCL 1.1 specification for the CPU, and with Microsoft* Windows* 7 operating systems""  Does this mean that on linux they don't support opencl 1.1?  ",®
t5_2qh03,wwwwolf,1317473884,"After it goes through their marketing department, it becomes Aperture Science Accuracy Calibrated Logic Decision Methodology®.",®
t5_2qn5f,Pearlsea,1317475295,Isn't BB getting android apps soon™?,™
t5_2qh6o,Dribblet,1317476781,I love spits. ♥,♥
t5_2cneq,jeannaimard,1317477232,"Young man, the US became the greatest nation in the world because it worships the saint-holy personal-responsibility, where genuine authentic real americans take the blame for their own moral shortcomings that make them deliberately choose a lifestyle that cannot support them, so that those who DO chose a lifestyle that enable them to be wealthy are not forced to pay for those who fail to be wealthy.   This message was sponsored by the Acme Sarcasm-O-Meter™ Ltd croporation.",™
t5_2qh4r,mvlazysusan,1317477869,"Um... This one is only 40 times better!   &gt;The MYT™ Engine has the potential to replace all the existing internal combustion engines and jet engines. With 40 times higher power to weight ratio, low parts count, low maintenance, high mechanical efficienty, and low pollution, the MYT™ Engine will benefit airplane, big ship, 18 wheeler, SUV, passenger car, even down to carry on power generator applications. The MYT™ Engine as a pump/compressor also exceeds exisiting pumps/compressors in providing massive pressure, volume, and flow, all in one unit.  http://www.angellabsllc.com/   (nothing goes up/down, or ever changes direction as the pistons do in the engine in this post) ",™
t5_2qqjc,iaacp,1317480865,Why not enjoy a delicious Pepsi™ today?,™
t5_mouw,GloriousDawn,1317481391,"From the article: *the first clumps of dark matter grew into larger and larger clumps through the hierarchical merging of smaller progenitors. Although the nature of dark matter remains a mystery*  We don't know what dark matter is, but it doesn't stop us from simulating its role in the universe. I ♥ science.",♥
t5_2qh96,dannydale,1317486454,Go fuck yourself. Reddit is Not Your Personal Army™.,™
t5_2qh3y,dannydale,1317487245,Fuck you Jaguilar26. Reddit is Not Your Personal Army™,™
t5_2sc3f,nnotserPx,1317487930,"I didnt even sign up to be a tester and I got one of these   edit: just checked my email  &gt;On September 29th, you received two emails regarding the Star Wars™: The Old Republic™ Game Testing Program. These emails were sent to you by mistake. This was due to an internal error and not the result of hacking or malware. Please be assured that no personal information was compromised. We are sorry for any confusion this may have caused. Please note that receipt of these e-mails does not affect your chances to be invited to test the game at a later date.   &gt;Between now and launch, we will be conducting additional large scale Beta Testing Weekends where we will be inviting more people than ever before. Additionally we will be releasing even more information about the game as we gear up for launch in December. If you haven't signed up for game testing yet, you can still do so at www.swtor.com/tester.  &gt;Thank you for your understanding,  The Star Wars: The Old Republic team. ",™
t5_2sm9e,CHEEZYSPAM,1317491634,"the shining. oh god the shining. I'd say that it's top of the list. I don't see why it's always placed in the Horror genre though. I guess 30 years ago, maybe... it has some creepy moments and moody atmosphere (and one scene that is generally ""scary"") but It's much more of a thriller.  Jack Nicholson is a god in that movie. Best performance ever.   ""Wendy? Darling? Light, of my LIFE. I'm not gonna hurt ya. You didn't let me finish my sentence. I said, I'm not gonna hurt ya. I'm just going to bash your brains in."" ♥♥♥",♥
t5_2qhad,blooit,1317492600,"I hate to be the voice of reason here, but we are a consumer-driven society, NOT a consumer-saving society.  Creditor-card holders are typically treated better than debit-card holders.  I recently applied for Chase Freedom® Visa with $250 Bonus Cash Back.  You spend $500 within the first three months and get $250.  Does this ring a bell to anybody?  At about the same time, I received coupon code to open a Chase Total Checking (TM) account for $200.  The $200 is basically interest that will be reported on Form 1099-INT.  I ended up getting both, because I read the fine print and know how to play the game.  Full disclosure:  I closed my WaMu checking account two years ago when WaMu was sold to Chase.  My median credit score is 820.  My lowest is 799.  For somebody who isn't as sophisticated, use credit cards and pay off your revolving balance at the end of the month.  You'll typically get a 30-day grace period to do so.  You'll rarely have to use your debit card or need to go to the ATM, unless you have poor credit and frequent gentlemen's clubs.  When you have an unauthorized charge, you credit card company will fight for you.  Not so with a run-of-the-mill debit card.  Last, but not least, if you carry a high credit card balance or if you have a high APR, you can generally negotiate to get your balance forgiven or rate lowered, or both.  I doubt BECU and WSECU are so willing.",®
t5_2qh4r,mvlazysusan,1317493209,I'd like to show you just the tip of the iceberg that awaits the GOP:   &gt;Ron Paul leads among Tennessee GOP convention delegate applicants  http://www.topix.com/forum/who/ron-paul/TKUBPE94BCO6S4PQF   Happy sailing  ☺,☺
t5_2qh0u,42z3ro,1317493999,"They forgot the part where it says ""which one is better?"". ☐ Soccer ☑ Football",☑
t5_2qh0u,forrestpk,1317496090,This is exactly what I wanted. I hope they can find a way to make that technology accessible on a smaller scale. I would love to have a small turbine spinning in my basement with constantly available kinetic energy. Please make sure to send me all science articles from now on ... you clearly have excellent Science Taste™,™
t5_2qm35,Frustration-FTFY,1317496380,"Then, Mr.Toomuchspinning, we dont take kindly to folks who dont get kindly with too-much-spinning around here. And we got no oil. Go back to US and A!  *insulted for being American* ☑   edit: Also you require additional **țuică**.Our number one anti-vomit medication.",☑
t5_2qmeb,neguohsi,1317496805,Meowth! ♥ It's funny because just last night I realized Meowth is my favourite Kanto Pokemon...,♥
t5_2r9tk,musemaker,1317498411,"I know exactly what you are feeling. Sometimes it is hard to initiate when he is so good at putting you into that subspace. I have the same thing you do with choking or even just when he puts his hand around my throat. I can not say no and only want to please him. Orders or commands given while in this position can not be disobeyed even after the hand is removed. However you can still initiate with out loosing your submissive role. Think about his pleasure first. Even just letting your hands wander in a kiss can give him the idea that you want him. Or if you want to be a little more forward simply telling -or begging- him to fuck you can work perfectly. Haven't tried this one yet but, coming up to him while he is sitting and initiating oral before he even gets a chance to start something. You can stay submissive by pleasuring him first, and then he can take over when it's time to return the favor. Hope this helps a little, and sorry for the wall of text. :)  Have fun! ♥",♥
t5_2qh3p,NotFromReddit,1317499214,You're cool ♥,♥
t5_2qh0u,musemaker,1317501081,Unless of course we come from a British family.   ♥,♥
t5_2rgyt,mynameismeech,1317501564,"Thanks for the heads up! $3.75 is a fantastic price, it worked without a hitch with the Steam version. It's a nice change of atmosphere ☺.",☺
t5_2qh0u,i_steal_books,1317503566,✔ chick  ✔ cat  ✔ upvote,✔
t5_2qh0u,paslematin,1317504287,© 2011 [Brent Stirton](http://www.brentstirton.com/) ,©
t5_2qi6d,isharq,1317504917,"The description reads ""© The respective original producers"" - that doesn't mean it's specifically made; it certainly doesn't explain by whom or why...",©
t5_2cneq,priegog,1317505361,"&gt; Now, that is just ignorant. All I know are statistics. Black people commit more crime, and that's a measurable fact. The militant black subculture is far too aggressive in its demands for reparations from white America, and I honestly believe that, as a whole, blacks are more racist than whites. White guilt is pathetic, being politically correct is a waste of time, and affirmative action is damaging to our functioning society.  Ah, there it is... It never fails to surprise me when I end up recognising people like you, by making a prediction about one of your completely unrelated beliefs.   &gt; To me? To Webster.  Yeah, except that when it's the police doing it to americans, it's the worst violation of human rights in history and they should be hanged. &gt; I think you don't understand the environment as well as you think you do.  I know you will ignore this just as you have ignored the rest of my inconvenient questions, but, again, do you deny that the killing of innocent civilians happens in Afghanistan?   &gt; Have you?  What TF does it matter? You're the one who made that asinine and stupid claim. Do you not understand how rational discourse works?  &gt; When did I insinuate that?  When you refer to the killing of innocent civilians as ""collateral"", while refering in that other fashion to the macing of protesters in the country. Come on, deny it!  &gt; Egypt, Libya, Syria, Jordan, Israel, Iran, Rwanda, Mexico, Venezuela... should I go on?  Oh, I definitely disagree, but you wouldn't care to listen, since the idea that some third-world country governments work better than the one of ""the greatests and bestest nation god put on this earth®"" would probably make your head implode. But just notice the list of countries you yourself made... they're all third world countries. Also, I wasn't referring to administrative corruption; but to moral corruption.  &gt; I don't come to your job and tell you how to suck dick, do I?  Did I tell you to suck dick? I'm giving you honest, and most of all truthful advice here. But feel free to see it as a critique or an insult.       ",®
t5_2qi6d,DubiumGuy,1317505639,You could call it 'Top Gear™ Motorcycle Takeover'.,™
t5_2sebm,heyboyhey,1317506155,have some more! ♥♥♥♥♥♥♥♥♥,♥
t5_2rmpy,Sylocat,1317508784,"I'm always wary of lionizing The Good Old Days™, and I think the Reddit Hive Mind attributes any opinions it dislikes to the Reddit Hive Mind.",™
t5_2rtff,Sylocat,1317508832,"I'm always wary of lionizing The Good Old Days™, and I think the Reddit Hive Mind attributes any opinions it dislikes to the Reddit Hive Mind.",™
t5_2r05i,mrfoof82,1317509738,"Yep, emoji.  Panic Software launched Poop.la the day Lion was launched:  [http://💩.la/](http://💩.la/)",💩
t5_2qzb6,jeannaimard,1317510655,"You live in Amerika, land of the Saint-Holy Personal Responsibility™, where real men take the actual responsibility for paying for their own stuff instead of billing richer people for it.  This message sponsored by the Acme Sarcasm-O-Meter Ltd. croporation.",™
t5_2sm1u,castillar,1317511783,Also known as A Great Place To Be When The Zombie Apocalypse Hits™!,™
t5_2qh63,Elliptical_Tangent,1317511877,"Fossil fuels are ~30 years from being used up if we're lucky.  Every month a well goes dry and a new well has to be dug in a more hard-to-get-at field for less oil.  Without all that cheap energy we blew making Furbies™, space travel is completely infeasible.  So, no.",™
t5_2cneq,gdroxor,1317513060,America! At Least We're Not Rwanda™,™
t5_2qpp6,AresHero,1317514332,"Thx, will do! ♥",♥
t5_2qh03,RelevantRecipes,1317514713,"But then you can make:  Smoked Steelhead Trout:  2 pounds steelhead trout fillets  2 tablespoons olive oil  4 cloves garlic, chopped  1 1/2 tablespoons dried rosemary, crushed  1 cup sugar-based curing mixture (such as Morton® Tender Quick®)  1 quart water  ground black pepper to taste  1 pound alder wood chips, soaked in water or wine  Directions:  1. Rinse the fish fillets and place them in a shallow glass baking dish. Drizzle olive oil over the fish and season with garlic and rosemary. Rub the seasonings into the fish. Cover and refrigerate overnight.  2. Dissolve the curing salt in the water and pour into the dish with the fish. Let it marinate for 15 minutes per half inch of thickness.  3. Meanwhile, prepare your smoker for a four hour slow burn using charcoal. The temperature should be at 150 degrees F (65 degrees C) before you get started.  4. Remove the fish from the brine and discard leftover liquid. Place each piece of fish onto a small piece of aluminum foil - just big enough to hold the fillet, and season with pepper to taste. Place them on the rack in the smoker. Sprinkle a handful of the soaked wood chips over the coals or place in a heat box. Cover and allow fish to smoke for 2 hours, adding more wood chips as needed.  5. Increase the heat in the smoker (add more charcoal) to 200 degrees F (95 degrees C) and let the fish smoke until the internal temperature of the fillets reaches 165 degrees F (72 degrees C). Remove from the smoker and let rest for 20 minutes before serving.",®
t5_2qh2p,zendak,1317518512,It would not have surprised me to see this in the footer:      ©2011 A Landover Baptist Church / ChristWire / Edward Current co-production.,©
t5_2qh0u,Indecisive_Yes_Man,1317519730,"Unfortunately I'm fairly certain that I do have a dick, but I'll give this response a shot anyway.  The reason that people enjoyed Reddit was because of its original™ content.  Of course original™ doesn't really mean ""original"" 95% of the time, but it does mean unique to Reddit or this source.  Now this experience is ruined when a user finds the same thing posted twice.  The idea of a site like Reddit is to act as a compilation and filter to the internet so that users can find the best of the best quickly.  This is also ruined when users are able to get away with posting the same things over and over.   Another point:  I will agree that there is an unlimited supply of karma, but I will also tell you that there are people who strive to collect it.  It may sound odd, but the mere fact that anyone holds karma to that standard gives it value.  While there is an unlimited theoretical value, it is used with discretion as if it has legitimate value.  So do you honestly think that every repost is an accidental slip-up or do you think that it's possible that some people do legitimately find popular posts and repost them with other motives?",™
t5_2qhm7,vinciblechunk,1317521829,[Giga-Knight™! Giga-Knight™!](http://pbfcomics.com/155/),™
t5_2qi63,crankybadger,1317523369,"If your city had ""Scotiabank®"" in the name it would be.",®
t5_2qhn5,McVader,1317523946,"*YOU CAN'T C©PYRIGHT A MOVEMENT!*  Okay, so can we agree then, no Guy Fawkes masks?",©
t5_1rqwi,shadearg,1317524017,"I think they configure it that way so that it *Just Works™*, privacy implications be damned. That said, NoScript is certainly useful even with global scripting enabled.",™
t5_2qh33,FreeName,1317524465,ily 5 eva   ♥♥♥,♥
t5_6,Rswany,1317525988,Xysedshsxe!#'64$6™,™
t5_2qq5c,Noveacc,1317534641,"*Definitely*, but only if you tease us and do it *really* slowly.  I ♥ when a girl is teasy.    :D",♥
t5_2qhk3,Alanna,1317534729,"Top five headlines right now, sorted by best, from this week:  1. I was surprised and delighted to find this on the 'bro tips' tumblr. Even bros know the truth about Nice Guys™ (Bro Tip #17: ""I'm nice, but girls won't date me.""  doing something nice to get something in return is called being manipulative.  grow a pair)  2. A 7-year-old girl responds to DC Comics’ sexed-up reboot of Starfire  (all about how the blogger's daughter prefers the Teen Titan version of Starfire because the new one ""doesn't do anything, just stands around not wearing much and posing"")  3. Due to the handiwork of a fringe religious activist, Mississippians will soon vote on a ballot initiative that would ban abortion in cases of rape and incest. (self-explanatory)  4. Saudi Arabia Gives Women Right to Vote and Serve in Government (self-explanatory)  5. Supreme Court Won't Reinstate Texas Abortion Sonogram Law (self-explanatory)  So, looking at the comments:  1. I was pleasantly surprised to see the top one one rejecting the whole ""Nice Guy"" consternation.  However, you don't have to go very far down to see a number of comments-- such as all of fifthredditincarnati's-- arguing passionately and at length with someone saying that maybe Nice Guys really are mostly just... socially awkward nice guys?  Remember that the point isn't that ""Nice Guys"" as they are defining them exist-- we all agree they are out there-- but that there is some kind of epidemic of socially awkward guys acting nice solely to sleep with you, and that this is somehow heinously worse than, say, dressing nicely or working out to get a girl to sleep with you.  Anyway, a pretty  negative view of men.  2. I'm glad they agree with the business decision, but the snarking at the male demographic for comics is unnecessary.  3. Just abortion debate.  Surprisingly balanced for a feminist forum.  One snark at the bottom at Mississippi.  4. Oh, boy, a goldmine!  Check out what they say about /mr.  I *guarantee*, without looking, that the comments they quote were downvoted.  --Oh, hey, I was right.  And what a surprise, it's brunt2 and thingsarebad making most of them.  5. Not many comments there.  I could go further, and I haven't even touched /r/feminism, but, suffice it to say, bitter people are negative, regardless of their cause.",™
t5_2qq5c,Noveacc,1317538829,♥  You're welcome.  ;),♥
t5_2r9vp,annYongASAURUS,1317539181,doritos ♥ ,♥
t5_2qh0u,Irate_drapist,1317541738,Did anyone else notice this?  &gt;© 20011 by George Chamoun.  No wonder he's so good at photoshop. ,©
t5_2qq5c,Noveacc,1317542698,I *just* love your long pretty hair.  ♥,♥
t5_2r05i,wizjany,1317545975,Now with twice the phallus™,™
t5_2qpp6,cwm0930,1317546964,The GSL curse is finally broken!  Well atleast one  ☑  MKP getting second  ☐  The finals being shit,☑
t5_2qq5c,Noveacc,1317547350,If only...  ♥,♥
t5_2qhad,Chroko,1317557905,"However, the short-lived ""I ✈ NY"" shirt was fucking hilarious after 9/11.",✈
